title,selftext,id,score,upvote_ratio,num_comments,created_utc
"I'm begging you to watch until the end. Electric cars are gonna save us all. Oh, wait. Did he say their power grid generates electricity using 95% coal... at the same time Bedwetter Biden, AOC, and the roving band of absolutely lunatics in Congress are killing off coal? Explain to me how this makes",,mz474l,167,0.91,197,1619461184.0
Destroying global warmism with a picture,,hme2ar,162,0.91,49,1594062419.0
Fraudulent Mike has Blood on his Hands,,gvvk66,163,0.9,26,1591196594.0
"Antarctica just set its Coldest March Temperature on Record: a ""Global Warming"" Destroying -75.3C (-103.5F)",,fnmlzh,166,0.87,31,1584980096.0
In 2010 a man shot up the headquarters of Discovery Channel because he didn’t think they were doing enough to combat climate change.,,ef1s17,165,0.91,19,1577196462.0
"David Bellamy died today. TV botanist, lifetime environmentalist, he was a familiar face on British Television until he was ostracized over his views on climate change. ""I was shunned. They didn't want to hear""",,e9f9zz,165,0.94,17,1576107407.0
The Carbon Footprint Sham,,119ukcv,165,0.92,64,1677148391.0
"If you listen, you can almost hear the liberals...""global warming, climate change, global warming, climate change...""",,guvnjc,164,0.9,7,1591054001.0
"Antarctic ice cores show not only was the last interglacial (and the 3 before that) much warmer than this interglacial, but the entire 1st Millennium was much warmer than today as well. CO2 levels ranged between 250-280 ppm for all these warmer periods. 🤔",,dy26md,163,0.93,45,1574077834.0
30 Year Anniversary of the UN 1989 “10 years to save the world” Climate Warning,,c7ldel,164,0.94,9,1561938514.0
Always measure relative to the coldest point,,pyo8rp,166,0.92,94,1633021885.0
In Light of Recent Events,,kxaeay,163,0.89,61,1610645750.0
University of Michigan climate researchers concludes that some of the latest-generation climate models may be overly sensitive to carbon dioxide increases and therefore project future warming that is unrealistically high.,,gb1ukv,163,0.97,17,1588273065.0
Critics blast California bill to mandate climate change lessons calling it brainwashing and indoctrination | The College Fix - Jan 2020,,g0dgsw,160,0.92,54,1586759272.0
AlReAdY kIlLiNg MiLlIoNs,,fgq9lm,160,0.92,87,1583895106.0
Banned from /r/science for discussing Climate Change,,ela16y,163,0.91,86,1578394343.0
"Do Your bit, don't be a hypocrite!",,p5obe3,163,0.93,27,1629145476.0
Corona Exposes Inconvenient Truth: Pollution From Diesel Cars Grossly Over-hyped By German Activists,,g196tm,162,0.95,12,1586883251.0
'Mickey Mouse' and other fake scientists revealed as signatories to massive climate petition,,dsvjuw,162,0.9,13,1573120004.0
Let Them eat Cake,,r5ryoo,161,0.93,173,1638292113.0
.,,krt6u9,164,0.84,56,1609955897.0
Science!,,eepssp,162,0.78,138,1577131777.0
Add this to the pile of alarmist predictions that ended up being dead wrong,,bzs6es,161,0.92,38,1560351138.0
Funny and sad,,135ruls,158,0.93,2,1683043129.0
Hypocrisy: Bill Gates Jets In to Give a Climate Lecture to Billionaires who Arrived by Private Jets,,ohp28x,158,0.95,36,1625944992.0
Why is nobody talking about Greenland? It's currently GAINING record amounts of Snow and Ice...,,oeyu6c,161,0.94,114,1625590020.0
One volcano spews more pollution than mankind has since we've existed.,,mm3suh,163,0.9,70,1617807011.0
Undeniable fact: “Carbon Dioxide” is NOT a “pollutant” but a Giver of Life,,mkmdx7,160,0.94,62,1617634043.0
Alarmist Barometer,,ltxvzi,162,0.88,13,1614461706.0
Argumentum ad hominem,,kvezzw,160,0.91,26,1610407680.0
Unprecedented Drought,,izs4sc,159,0.94,18,1601068244.0
Michael Moore: We're Done in Four Years if We Don't Fix Climate Change,,ese65w,161,0.89,67,1579709677.0
This is turning in to an anti-Greta sub. Are we ok with that?,"I for one would like to keep this sub about scientific discussion of climate change. I do not need all these videos of Greta protest, Greta quotes and Greta memes.

Who here agrees with me?",dkftl2,161,0.84,113,1571551572.0
"""Come to the dark side.""- Darth Soros LOL",,d9cs12,162,0.92,7,1569461518.0
Why did Greta Thunberg delete this tweet?,,11p8rp9,159,0.81,128,1678607240.0
Scare people so our lithium lobbyists are happy,,ouc4p0,156,0.9,11,1627613204.0
"This is so much ""greener"" than that Keystone XL pipeline, right?",,lk10a2,159,0.93,52,1613347834.0
Last year: sAVe tHE pLAnEt! This year: dOn'T KiLL gRAnDmA!,,jtklo2,158,0.87,13,1605290221.0
Biden Uses Private Jet To Lecture Commoners About Climate Change,,iubyh4,163,0.94,19,1600315334.0
"Cancel the Permafrost Apocalypse: Study in Science finds Even if methane is released from large natural stores, very little actually reaches the atmosphere",,f8f810,161,0.95,15,1582489402.0
Temperatures are Falling across the Globe according to NOAA Data but NASA conceals this Fact,,ezrsfc,158,0.91,77,1580992783.0
"How extremely ironic, and hypocritical coming from a news site with a far-left progressive bias",,etdiw9,158,0.92,45,1579886908.0
"Reminder that whenever a climate change zealot uses the ""97% of scientists agree"" quip, it's proof they don't care about science.","When someone makes this claim it's not much different than someone claiming that vaccines cause autism. These people parrot the 97 percent quip because they haven't done any actual research and they think it's a ""gotcha"" statement. It's a way for them to simply shut down any real conversation on the issue because discussing it would actually require effort. The reality is that the paper this 97% claim is based on actually identified just 0.5% of scientists as reaching the conclusion that humans are the primary cause of AGW. 

The 97% “consensus” study, Cook et al. (2013) has been thoroughly refuted in scholarly peer-reviewed journals, by major news media, public policy organizations and think tanks, highly credentialed scientists and extensively in the climate blogosphere. The shoddy methodology of Cook’s study has been shown to be so fatally flawed that well known climate scientists have publicly spoken out against it.

""Cook et al. (2013) attempted to categorize 11,944 abstracts of papers (not even entire papers) to their level of endorsement of AGW and found 7930 (66%) held no position on AGW. While only 65 papers (0.5%) explicitly endorsed and quantified AGW as +50% (Humans are the primary cause). Their methodology was so fatally flawed that they falsely classified skeptic papers as endorsing AGW, apparently believing to know more about the papers than their authors. Cook et al.’s author self-ratings simply confirmed the worthlessness of their methodology, as they were not representative of the sample since only 4% of the authors (1189 of 29,083) rated their own papers and of these 63% disagreed with their abstract ratings.""

https://www.sciencedirect.com/science/article/pii/S0301421514002821?via%3Dihub",ekbp4h,160,0.9,22,1578222375.0
Australian legislator uncovers that country's Bureau of Meteorology fiddling with temperature records to hype warming,,dngk2p,160,0.95,21,1572109265.0
"Found on OccupyDemocratsLogic Facebook page. Yup, she's being used",,dbn1u8,163,0.91,26,1569898946.0
New Report: “The economic growth and well-being in Europe and the United States are more threatened by extremist and delusional environmental policies than by global warming.” See comments for details.,,12pxgws,156,0.77,141,1681766735.0
"A farmers' party has just stunned Dutch politics, w 20% of the vote will be the biggest party in the upper house, will have leverage",,11t34av,158,0.96,17,1678993450.0
"Problem is, most are ignorant, benighted and brainwashed. They suffer herdthink and mass psychosis. And they would never believe the MSM and their government would lie to them and deceive them. Never. But, of course, they do. Every single day.",,zu84mi,156,0.8,167,1671881719.0
Say No to Communism,,mxm4uu,154,0.91,85,1619277942.0
"Anyone else sick and tired of people not understanding the basics of fire management, history and plants",,eo164k,159,0.89,30,1578902122.0
'Mickey Mouse' and other fake scientists revealed as signatories to massive climate petition | Sky News Australia,,dszsex,161,0.94,4,1573142777.0
Greta Thunberg without a script to read from,,d9jo77,160,0.93,28,1569504620.0
Best summary,,11wr3l7,159,0.8,159,1679337204.0
"Illustration of the progress of the ""science""",,1067fr4,159,0.91,32,1673145633.0
Poor Greta needs her money!!!,,meituy,157,0.91,20,1616867484.0
Gallup Poll: Americans Once Again Rank ‘Climate Change’ Dead Last As Least Important ‘Problem’ at 1%,,i693k8,159,0.92,18,1596929132.0
Extinct rebellion.,,gg4ykc,157,0.94,17,1588983218.0
Concerned citizens report Greta Thunberg’s parents to Child Services in Sweden for child abuse of 13 year old sister,,ep8qvy,156,0.91,34,1579123613.0
Another Left Website caught deleting a post a couple years back of the green party calling for reduction in burns after it was linked on twitter...this time by the then Deputy Greens Leader (2nd in charge),,em88wq,154,0.94,11,1578568405.0
NOTHIN BERG,,ejtjeq,155,0.89,8,1578122711.0
That's really mean.,,e55885,156,0.91,23,1575319598.0
"""Let's invest trillions of dollars into something that won't even work""",,cxj7cb,156,0.9,11,1567182160.0
Lets bring in Greta!,,go2pmd,154,0.92,3,1590087036.0
Galileo Galilei,,fbm2nw,157,0.91,52,1583023328.0
"List of 11,000 scientists calling for climate emergency includes names such as Professor Mickey Mouse",,dspcvv,160,0.91,22,1573086322.0
Global green communism,,125bycf,154,0.86,42,1680060979.0
Richard doesn’t get invited to any private parties hosted by the globalist elite or their controlled media cabal. But Richard doesn’t mind. He sleeps well at night.,,w7qpt8,155,0.84,139,1658760182.0
True words from iron lady,,rh4qj3,152,0.91,17,1639590259.0
"CNN: ""Our next thing is going to be for climate change awareness - Climate change is going to be the next COVID thing for CNN…Fear sells.”",,mr8hln,156,0.93,12,1618465295.0
Going back in time,,lrs99u,155,0.88,62,1614214059.0
The Sky is Falling.....Or is it?,,gkt5rt,154,0.91,10,1589628569.0
"If the ""science is settled"" why are climatologists still getting tax dollars to study it?","We don't continue to hand out billions to study whether the earth is flat or round, so why is an exception made for ""climate science""?",evv336,152,0.88,89,1580339020.0
Children of the climate,,d9fsuk,159,0.88,26,1569479307.0
The Science is Settled!,,cnrf3m,157,0.91,12,1565295763.0
Climate Alarmists Caught Manipulating Temperature Data Yet Again,,c6ogi8,156,0.95,32,1561749928.0
This is the gov of Oregon Kate brown. She’s forcing state senate republicans to be present for a climate change vote at gunpoint. If you ever weren’t totally sure climate change was an authoritarian power grab now you must be.,,c4s5l7,157,0.88,34,1561398061.0
"Google removes the name of Patrick Moore from the search results of ""Greenpeace founders"" because he came out against the Green New Deal",,b24ccg,153,0.96,13,1552822766.0
🏙️,,12c5lje,153,0.84,38,1680662090.0
Europe is greener now than 100 years ago,,q4ache,155,0.95,22,1633738692.0
Biden's Own 'Climate Czar' John Kerry Admits Pipelines Are Better for Transporting Oil in Face of Keystone XL Shut Down,,nbkva2,153,0.95,22,1620923773.0
Chris Wallace Adds Climate Change into Debate Despite Not Being on Topic List,,j2wgkg,150,0.94,14,1601505704.0
The Vision of Occasional Cortex,,gnv0b1,153,0.82,16,1590059906.0
Soros Starts $1 Billion Anti-American University: Fighting nationalism and climate change are its goals.,,f2dwbj,157,0.91,21,1581450898.0
I’m 100% against pollution,,daps80,151,0.89,34,1569726162.0
Eco terrorists didn’t take into account that police can jam signals 🌚,,d49v5j,157,0.96,18,1568489664.0
"Italian press reports, 114 private jets, and 114 flights from Los Angeles spew estimated 100,000 kilograms of CO2 into the air, as elites from business, finance, politics, entertainment, attend ""Google Summer Camp"" at Sicilian seaside resort to fight ""Climate Change""",,cka4td,158,0.95,20,1564587832.0
"This revelation relates to the 2013 UNIPCC climate report and should have put an end to the AGW hoax. Instead, the lies, dishonesty and scare mongering simply escalated. If you're not asking questions about this, and aside from anything else, you're part of the problem.",,wb10aw,155,0.92,115,1659089736.0
Consensus Science,,ufh6tm,152,0.8,64,1651343930.0
Not Funny Guys....,,rhhmfm,154,0.88,50,1639626247.0
Peer-Reviewed,,likise,149,0.91,36,1613163313.0
Life in the Beautiful Green Utopia,,kyv820,151,0.78,112,1610843435.0
The Horror.....the Horror,,k6m4iq,152,0.78,39,1607092956.0
Climate Activist Leaves Environmentalist Movement Because it’s Too “White”,,f0i4u4,156,0.95,28,1581114604.0
Breaking News - US Temperature less in 2019 than it was in 1900 - NASA / NOAA 2019 report analysed and critically destroyed,,errtw6,156,0.91,45,1579595514.0
"According to The Heartland Institute, The Planet Might Not Be Warming Like NOAA Says. Believers won't read it cuz Heartland hearts big oil.",,erl6t9,155,0.9,51,1579560615.0
"So, this is dramatic?",,eqkbhl,153,0.91,30,1579372723.0
"27 Simple Bullet Points Prove Global Warming by the Sun, not CO2: By a Geologist for a Change",,emr69k,155,0.91,87,1578664282.0
"Hanoi Jane’s Hypocritical Luxury Environmentalism; A mansion for her, and nothing for us.",,ehlql7,152,0.92,10,1577710630.0
