title,selftext,id,score,upvote_ratio,num_comments,created_utc
Hypocrisy,,eoifs9,926,0.95,114,1578989335.0
Its all about the carbon TAX SCAM,,ddyvbc,784,0.93,153,1570338112.0
Yep,,eurx49,774,0.95,108,1580149274.0
I think I'll wear a fur coat to protest the sale of fur,,e5zlbs,693,0.94,74,1575467891.0
Look,,da684o,645,0.92,95,1569616837.0
"hmm, I wonder why the media is only pushing climate change propaganda in the West",,eu7ofa,621,0.89,119,1580050798.0
"I wonder if she wants them ""up against a wall?""",,emdn7o,617,0.87,109,1578594165.0
The hockey stick graph is real,,dfhnuo,586,0.96,103,1570630629.0
Fun Fact,,dz6mkd,586,0.88,134,1574276780.0
Climate alarmism couldn’t exist without hypocrisy.,,ey65dd,578,0.91,58,1580731250.0
Scientists say meat is crucial for human health and call for the end of pushing 'zealotry' veganism,,134x09w,574,0.79,251,1682965207.0
You only got 12 years to avoid disaster,,dcgyt3,568,0.94,26,1570052088.0
“Let’s fight climate change!”,,f8royq,566,0.93,77,1582553238.0
Alarmism won´t go extinct,,edsk0k,568,0.87,136,1576948936.0
Who are we gonna believe?,,eqrz3e,555,0.88,105,1579409262.0
Who Wants To Stop Climate Change?,,ejk3t5,526,0.92,50,1578078796.0
The double standards.,,enfol8,531,0.9,52,1578787328.0
Carbon-Hypocrites,,fhk3d5,518,0.87,45,1584034357.0
The alt Left turns a blind eye to CHINA!,,dadvpn,519,0.82,258,1569663050.0
See the heat. Feel the heat.,,ecg3iv,515,0.89,117,1576692114.0
Greatest Actor of all time with DiCaprio!,,dr0w8f,493,0.86,59,1572790384.0
climate UN changed,,daj161,486,0.88,84,1569691800.0
"One day, she'll realize it...",,fho8li,476,0.94,36,1584049440.0
But Muh Prius (eyes closed),,evn3rg,483,0.87,152,1580305755.0
"There, that was easy.",,e1rgtf,475,0.94,36,1574736260.0
Greta has no idea how privileged she is,,eewb0n,476,0.88,64,1577162369.0
"I changed my mind, guys!",,boxyu8,467,0.94,130,1557927031.0
Stolen childhood starter pack,,e5hd9m,466,0.93,71,1575381006.0
"Well, who would have guessed...",,f7f1s4,459,0.86,102,1582308549.0
Greta is watching,,e8fl8i,453,0.9,95,1575923658.0
"""Experts""",,dk5q1k,450,0.86,112,1571501219.0
Was anyone actually surprised by this?,,e52tyq,450,0.91,71,1575309923.0
Unless it’s all intentional,,fs6iwq,449,0.91,95,1585629575.0
ALL ABOARD!,,dm50h9,437,0.9,64,1571861777.0
Hmm I wonder..,,eo3fn8,428,0.89,51,1578918298.0
Must. Save. Climate.,,fi9j4q,428,0.92,12,1584144115.0
B-but global climate warming/cooling/change is serious business...,,emxkdh,423,0.85,155,1578691963.0
The end is nigh. Rinse and repeat.,,diu5hd,419,0.93,29,1571253230.0
Elongated Musket appreciation thread for playing fat atheists like a fiddle,,gblcv9,424,0.91,116,1588350716.0
The truth,,e3skkp,415,0.95,21,1575099148.0
"Wikipedia Deletes ""List of Scientists who Disagree with the Scientific Consensus on Global Warming"" in Astonishing Act of Censorship",,feymxl,415,0.96,75,1583603557.0
Hmm,,e7wvx1,410,0.9,36,1575827746.0
Definitely backfiring ...,,e71pwv,406,0.87,57,1575653510.0
What a man,,es1njt,411,0.92,72,1579643162.0
A Dilbert classic on the lunacy of the “settled science” of climate change,,cz5ed8,409,0.94,22,1567519916.0
97% of all scientists agree in Global Warming and Green Backs,,j1la3y,404,0.93,68,1601328262.0
Science can be confusing.,,ge3eeg,405,0.94,63,1588703922.0
It is that simple.,,femvmn,404,0.92,55,1583539759.0
sEtTLeD sCiEncE,,diml15,407,0.89,61,1571216489.0
"So, the science is settled?",,df4e8q,398,0.92,48,1570560863.0
Climate Change Isn't The Hoax,,f7lhqx,401,0.91,103,1582335482.0
"More failed points of no return, Greta's to young to remember these and her parents will never admit the truth...",,ehb7t3,392,0.85,79,1577652239.0
Climate Activists are lighting fires on purpose to blame on global warming,,ekhvuj,393,0.9,165,1578253256.0
"If you're mentally ill and can't tell the truth, there may be an opportunity for you in ""climate change""",,dukefx,390,0.84,105,1573433191.0
The future is hilariously ironic,,co69m1,389,0.94,31,1565374645.0
Climate Cultist!,,dew3iu,394,0.89,31,1570515541.0
Right on point,,g83r4f,386,0.93,54,1587857516.0
What emergency?,,ds9dar,392,0.92,51,1573005319.0
Thatcher evolved. Millions have joined her.,,g4xt6o,384,0.93,38,1587405715.0
"Hmm, That's a good question",,lpilpn,385,0.89,162,1613980949.0
With a little gentle force.,,fb3lej,379,0.86,36,1582932562.0
"""Climate change is real, it is caused by human activity, and it is already causing devastating problems in America and around the world."" - Bernie Sanders",,eywpsc,374,0.91,83,1580849017.0
The First Climate Change Summit,,eq3re7,374,0.89,40,1579283473.0
University dumps professor who found polar bears thriving despite climate change,,dlj9i6,376,0.95,30,1571757058.0
"But--but--but--- the ""Science""",,n0irm2,370,0.89,62,1619627443.0
Hollywood Hypocrisy,,fjea5p,363,0.93,21,1584329175.0
Another failed prediction.,,fdxf8v,363,0.95,25,1583424443.0
Communism Lost. So now it has disguised itself as Social Justice and Climate Change,,eh38zn,363,0.9,85,1577604898.0
Rules for thee but not for me!,,dml416,366,0.96,71,1571944124.0
What Australia closing its 6 remaining coal plants will do,,f9euzt,368,0.93,97,1582655997.0
Don't fall for the Traps,,dvyoi3,363,0.92,17,1573680683.0
Pay no attention to the man behind the curtain,,ep5kgy,362,0.89,24,1579110503.0
Climate change alarmists going full Thanos.,,dozzfr,355,0.95,97,1572399554.0
The truth about science,,lkpjom,357,0.91,181,1613429924.0
Thoughts and Prayers for Britain and the European cities which were destroyed today,,eij9nd,354,0.92,51,1577891388.0
TFW your own country says no to your apocalyptic climate rants,,f7yil7,358,0.93,72,1582404263.0
Shifting the goalpost,,exafzs,357,0.91,74,1580582011.0
Snows of the Kilimanjaro to vanish by 2020,,gfsak6,351,0.94,81,1588940898.0
It's Like We Thought,,f5fc7u,354,0.88,83,1581972339.0
1st climate change summit.,,dqr6b6,350,0.87,43,1572731920.0
"Ladies and gentlemen, times person of the year!",,ei8fq3,352,0.89,74,1577824460.0
The Emperor's New Clothes,,f1gsya,350,0.89,96,1581289282.0
What is the cure for such disorders? Beatings.,,e9nvt8,342,0.94,12,1576159092.0
I think this image is pertinent to the recent bombardment of trolls and misinformed people,,ec1zrg,343,0.89,88,1576616809.0
Climate activists,,dl2z8r,345,0.94,63,1571675164.0
Dude literally superimposed the Mediterranean Sea over the USA and so many idiots just believe is what the USA will look like in 20 years,,11ygxfn,343,0.83,179,1679486603.0
so sorry gouize :(,,dgimxm,340,0.88,66,1570816026.0
When CO2 emissions are just fine,,kl1hai,343,0.95,54,1609064708.0
blaming Chinese people for eating bats is racist but blaming white people for eating cows is climate justice,,g0la5p,340,0.95,61,1586792233.0
"So, How Are The Bears?",,e0vynh,340,0.93,57,1574584254.0
KALI MAAA!,,ezxfjv,343,0.92,18,1581017063.0
"Hypocrisy, thy name is Bloomberg",,e6jut0,337,0.96,18,1575564565.0
Must Worship Climate Change,,f9psnz,333,0.9,48,1582703068.0
Well said,,br1scm,332,0.93,28,1558388575.0
"Only a fool ""believes""",,jhcq4p,337,0.91,83,1603559969.0
Wheel of Climate Change,,d1bod0,332,0.87,66,1567953418.0
"Rapid increase of ""extreme weather"" discovered... in the New York TImes.",,ew8eop,338,0.94,44,1580403275.0
Poor Greta,,fjo2v7,329,0.83,54,1584377474.0
Facts,,mm8n20,336,0.96,52,1617820313.0
Hmmmm...,,exut2x,326,0.9,24,1580676015.0
How CO2 emissions have changed since 2000,,d97v7n,328,0.94,120,1569438137.0
The green new deal. This is one of the reasons we are skeptic.,,epi9ju,331,0.87,111,1579175149.0
Lol,,dwbtv4,327,0.86,46,1573748829.0
Why pay the single price when you can pay double?,,f0icye,329,0.95,55,1581115563.0
"Tried to tell r/climate the 70s was all about Global Cooling, got permanently banned",,e4b55m,320,0.93,93,1575177187.0
So much science.,,gbapor,322,0.91,25,1588303843.0
This is EXACTLY how it happens.,,fpc8mk,317,0.9,53,1585232255.0
So gullible.,,fgn6r5,319,0.92,67,1583882219.0
It's not about climate change....,,eqgb5z,317,0.93,61,1579353689.0
"Uh-Oh, It's The CO2 Police",,e8zoav,315,0.88,40,1576025473.0
Everywhere is warming faster than everywhere else! Scientimificaly implausible levels of warming!,,dmz87c,317,0.94,120,1572018160.0
Sea level then and now (Balmoral Beach),,dkimif,316,0.95,121,1571572209.0
Alarmist Logic,,g9aibu,313,0.9,15,1588024967.0
Who did this? 😅,,erb6gl,317,0.92,55,1579513535.0
Would be funny if it wasn't sad and true.,,ec5hgh,312,0.95,10,1576632323.0
Greta Thunberg Parents Reported to Child Services in Sweden (Link is in Swedish),,dcrk96,311,0.9,118,1570112471.0
"Marching for the Climate is a thirsty affair, I get it (@ Potsdamer Platz in Berlin right after the march)",,d6yibl,314,0.93,51,1569001794.0
"Problem-Action-Solution, The Hegelian Dialect",,mzwsl8,309,0.92,35,1619552591.0
Rent seekers,,d5yvvk,308,0.96,10,1568818281.0
“Who hired the science denier?” — Dilbert,,f6mrav,309,0.95,40,1582169084.0
Don’t question people who dropped out of high school to protest a science issue.,,ew0o29,306,0.93,8,1580363425.0
Trump skips G7 climate summit,,cw4apr,309,0.92,86,1566911669.0
Who are the Lefts CLIMATE CHANGE experts??,,f48v7u,301,0.81,97,1581770204.0
#CARBONTAXSCAM,,d8fb4i,312,0.81,215,1569283847.0
This is deeply disturbing. Since when does the government not take the opportunity to waste more money?!,,f098zk,305,0.9,36,1581075135.0
Doomers rush in.,,e5err5,309,0.88,35,1575365685.0
The Cat is Smarter,,f3fcj8,303,0.94,18,1581622092.0
So when will Greta Thunberg end up on a CNN panel to be an expert on racial injustice?,,gvhd99,304,0.93,33,1591136748.0
Hypocrisy is easy to overlook if you like what they have to say.The joke is on America.,,e5gno7,303,0.97,4,1575377358.0
You have destroyed my childhood,,dxjiv9,303,0.85,145,1573974683.0
Good day comrades,,dvlebp,302,0.93,29,1573614237.0
The majority of people think electric cars will save the planet because they don't understand THIS,,12kzsgi,300,0.78,322,1681412710.0
Truth hurts.,,enumse,300,0.86,96,1578868073.0
"Ahh yes, there is nobody I trust more than 24/7 HipHop News to tell me about the stability of the planet",,cvuq2e,295,0.96,72,1566856206.0
Yikes they messed up there,,c5he3r,297,0.96,44,1561504797.0
It's a Climate Miracle,,fyv5ss,295,0.89,69,1586574013.0
!remindme 2028 when this prediction also turns out to be bullshit,,ebtvfl,293,0.92,66,1576576612.0
Extinction Rebellion logic,,e3i0dp,295,0.89,36,1575049601.0
Hmmmmmmm,,jfq30q,293,0.95,176,1603329647.0
Yeah,,d8sb93,289,0.87,23,1569354282.0
http://www.drroyspencer.com/2019/08/selective-and-misplaced-outrage-at-brazils-president-bolsonaro-over-amazonian-fires/,,cwzrzb,292,0.88,36,1567079227.0
Apparently every country on Earth is warming up faster than all the others 😂,,bgn9ca,294,0.94,23,1556061855.0
"Came Across This Meme, Found It Amusing",,m27rp8,290,0.94,67,1615408538.0
Climate Change Has Ended,,gtrec9,296,0.9,31,1590893985.0
How. Dare. You.,,ggg92l,290,0.94,58,1589034214.0
New age science,,12g20fo,290,0.89,69,1680996527.0
The media doesn´t give a shit about their readers opinion. 101% sure about this.,,ehb8xj,289,0.94,15,1577652380.0
Swedes Vote Climate Policy Biggest Waste of Tax Payer Money in 2019,,ennjqx,291,0.93,31,1578836351.0
So Let's Say We Fixed Climate Change,,gu5qmu,286,0.92,54,1590954995.0
Location. Location. Location.,,iywnwl,283,0.91,25,1600951893.0
Far-Left news site calls climate deniers “Far-Right”,,f21tci,282,0.93,127,1581389275.0
Black climate activist cropped out of the photo with Greta!,,etssz7,287,0.93,47,1579969551.0
"Ex-Top Gear host Jeremy Clarkson brands Greta Thunberg a ""spoilt brat,"" says the 16-year-old eco activist should ""shut up and get back to school""",,dbeaif,287,0.92,73,1569861654.0
There’s A New Girl In Town,,fp1kvx,279,0.93,45,1585182110.0
"What Climate Models look like ""under the hood""...",,f7u15b,281,0.91,29,1582385663.0
How Dare You!,,e9a02p,277,0.93,23,1576084914.0
The Frontline of Extinction,,kncqop,279,0.91,67,1609368364.0
What r/Science comments look like when posting a climate change article,,ena7i4,279,0.96,36,1578763352.0
Makes sense,,ehy5fy,281,0.9,56,1577768278.0
Trump formally pulls out of landmark Paris climate agreement,,drqb5z,275,0.96,36,1572910304.0
Modern Oppression - HOW DARE YOU!,,dxqzd1,275,0.93,14,1574018215.0
A More Realistic Picture,,fq7z19,271,0.86,89,1585350038.0
A handy guide to climate alarmism,,fm6n6s,273,0.92,19,1584752932.0
Logic,,f37dwp,274,0.87,34,1581585372.0
How dare you? - Delivered as ordered.,,efnr9l,270,0.86,27,1577317880.0
What a young person doesn't understand about the global warming scam,,dkpffv,274,0.92,39,1571603726.0
Why doesn't anyone protest China's environmental policies?,,dzofdo,271,0.92,36,1574364443.0
So transparent,,d5fu47,270,0.9,16,1568721031.0
Still collecting government grants after 40 years of being wrong.....,,k6yujz,274,0.91,147,1607133775.0
Why is Greta Thunberg in America,,d7xjwm,273,0.87,143,1569191193.0
Rules For Thee But Not For Me,,lcz5dz,273,0.94,6,1612498513.0
The uneducated are as foolish as they are inexperienced. -My Chinese friend’s grandma,,eg5hlx,272,0.91,54,1577416515.0
"Angry, again.",,e7fkmm,269,0.85,70,1575732518.0
For those who don’t remember,,e4uz1g,272,0.95,25,1575267995.0
"As australia burns, they would rather blame climate rather than talk about how they could have prevented them",,ek4h7y,273,0.89,148,1578180846.0
The Problem With Climate Science,,de5d8a,272,0.93,118,1570378757.0
Any day now,,n5ucty,270,0.92,79,1620259284.0
"Problem-Action-Solution, The Hegelian Dialect",,lnp3zq,275,0.83,139,1613765048.0
When you don’t realize that these images were made on a computer,,f4i7cl,269,0.91,80,1581811424.0
Climate model experts at work...,,gpis22,270,0.91,44,1590291781.0
Greta in 50 years after she realizes the world is normal,,d8vqx3,271,0.9,58,1569370404.0
Greta vs the PRC,,qsyp4a,269,0.95,97,1636799982.0
Climate Worship Is Nothing More Than Rebranded Paganism,,f283z8,271,0.9,101,1581426683.0
This Tweet didn’t age well.,,lr1220,266,0.92,61,1614133432.0
Accurate,,j8k1tt,267,0.92,39,1602334788.0
California 2035,,j0a58h,266,0.93,45,1601141361.0
"I’m confused, as a child I was assured by Al Gore that this couldn’t happen. It speaks volumes that in the article a park official says, ""The fact that forests are growing here can be problematic… It all depends which way round you look at it.""",,f0umtg,265,0.94,33,1581182815.0
The ulterior motive of climate alarmists,,egiaaq,264,0.94,56,1577487202.0
CNN getting truth bombed live on air,,qis09n,262,0.96,72,1635560715.0
Too much drama,,f3yees,263,0.91,33,1581712807.0
"Climate convert Jeremy Clarkson calls Greta Thunberg, 16, 'a stupid idiot' and a 'weird Swede with a bad temper' for offering no solutions to climate change while 'sailing across the ocean in a diesel-powered yacht'",,e4ftpc,261,0.95,42,1575197520.0
Basic but still not sinking in,,kavspl,261,0.9,131,1607661278.0
This is why aliens don’t visit us.,,ep00eb,260,0.87,13,1579079367.0
2080 climate change conference,,emmyne,261,0.87,9,1578636913.0
My moneys on the Chimp.,,d7ds5m,262,0.88,25,1569088477.0
Best definition of climate change,,pibgpr,262,0.87,63,1630841464.0
New Religion,,kwi0yl,257,0.9,187,1610549881.0
Now for a bit of positivity here. What a legend,,jtxzux,255,0.94,27,1605338559.0
She's baaaack,,gkgeko,258,0.89,68,1589573014.0
Global Hypocrisy,,gzjbr5,257,0.94,35,1591692807.0
The end is nigh,,cee4z0,262,0.93,33,1563376329.0
"Last time I checked Greta was not a scientist, a doctor or black.",,h8w4ly,257,0.9,32,1592149507.0
"Wait, what?",,egbveu,258,0.93,36,1577457414.0
"David Bellamy (RIP) was cancelled by the BBC as a prominent TV presenter for climate wrongthink. “For what shall it profit a man, if he shall gain the whole world and lose his own soul?” David lost his career but never sold his soul.",,12j31p3,256,0.87,114,1681258169.0
Greta Thunberg: Climate Change Expert & World-Renowned Immunologist,,gjnl1s,255,0.9,34,1589467146.0
Warmist hypocrisy,,daxtd6,256,0.85,50,1569776293.0
Follow the money,,d8lrkw,256,0.84,131,1569324153.0
Climate Science,,eyhn0s,252,0.92,111,1580778427.0
Bill Gates Buys Oceanfront Home Near San Diego For $43 Million ... He's A Big Believer In Global Warming...Won't His House Be Underwater Soon?,,g5wuk2,253,0.94,36,1587541054.0
The UN is pretending there is a link between Covid-19 and climate change. This kind of fake confused junk science is causing the death rate to soar....,,fomxfk,252,0.93,51,1585125724.0
"""Dayum! ...nice curves.""",,fjtuz6,254,0.95,18,1584397932.0
"Zimbabwe: Kicks out whites, has economic collapse and mass starvation. U.N. food agency: Climate Change!",,eppudk,252,0.94,39,1579209766.0
True 😂,,133oamq,253,0.78,114,1682858869.0
"Sorry for bad crop, but I thought this was relevant to the sub",,gmg9gf,250,0.95,32,1589856851.0
Debating with an alarmist:,,e064p0,252,0.87,45,1574451788.0
Post this on climate change subs and get instantly banned !!,,d9hvmh,250,0.89,159,1569494587.0
New Study.,,mmeuc3,251,0.93,33,1617838218.0
How about no...,,evitsk,251,0.95,143,1580277778.0
This is the existential threat,,nyuhts,250,0.9,23,1623584415.0
Sad but true,,n8o9rt,251,0.94,66,1620596294.0
"Since the shutdown, CO2 is rising. Perhaps it is from the oceans and forests and our contribution does nothing in comparison?",,gd0woo,245,0.93,138,1588549820.0
Another Climate Scientist with Impeccable Credentials Breaks Ranks: ‘Our models are Mickey-Mouse Mockeries of the Real World’,,dc2fnl,251,0.92,127,1569975298.0
A Tale of Two.....,,ry9u95,249,0.86,41,1641568993.0
Lolz,,ju70ms,245,0.91,37,1605379883.0
Inconvenient Climate Facts,,chmd0b,246,0.91,72,1564053543.0
I think we’re all dead now....,,k69b7f,246,0.9,123,1607039247.0
We just need to trust in the good sense of the government!,,pu76ba,244,0.9,37,1632438900.0
Restrictions & Sacrifice for Thee but not for Me,,rb84yo,243,0.95,27,1638907491.0
iT's a cRisIs!,,egd7bp,243,0.94,27,1577464115.0
"The arctics are melting 2 times faster, 6 times more than ever before.",,fpk0bb,244,0.92,42,1585257878.0
The 1970's global cooling scare is never mentioned these days. This goes to show how fraudulent the IPCC is and the extent to which Global Warming has been politicised,,dbn8pt,245,0.92,65,1569899871.0
"Greta Thunberg made a speech against the Globalist U.N as if they we not on board with the CARBON TAX SCAM. She's another failed experiment like David Hogg, NEXT!",,d8rt0h,242,0.88,27,1569352131.0
Climate Change,,k2w8vk,243,0.92,14,1606599479.0
Regarding the Value of Consensus,,gtfljd,240,0.95,43,1590850643.0
5.6 mpg,,oecxlj,240,0.91,163,1625508825.0
.,,lmp5e0,236,0.88,182,1613661847.0
WhAt A FoOl BeLiEvEs,,lmb7ad,242,0.92,83,1613614494.0
busy Atlantic hurricane season predicted by the usual models,,go4p9k,241,0.92,11,1590093250.0
I see we have a Winner here! Applause!,,fxfzse,238,0.91,40,1586383660.0
Just for fun,,eudnkz,236,0.94,23,1580075698.0
"Al Gore, first to make a billion dollars on the climate change hoax.",,e34hhi,241,0.93,18,1574976005.0
Just more proof of sea rise caused by global warming,,n3rys5,237,0.89,104,1620034159.0
"Pres. Biden’s $2.3 TRILLION spending bill on ""Climate Change"" is Bullshit",,mwy6di,241,0.93,40,1619192698.0
"Crickets from green groups as Trump makes U.S. the global leader in emissions reductions, International Energy Agency shows",,fdfzlr,241,0.95,29,1583341305.0
A 'only ten years' left from 1972. I hadn't seen it quite that far back. We are 39 years too late!!,,p6br5n,239,0.92,24,1629232031.0
If we just give AOC 74 trillion dollars the hurricanes would stop,,ietw7k,240,0.9,57,1598143036.0
"A 2000 years old Nazca line was ruined by these greenbies, great",,hbcx41,239,0.95,43,1592480053.0
“Pay money to the government and the whether should be sorted out!”,,fj7aem,234,0.93,30,1584301789.0
Do as I say not as I do!,,f0m4db,232,0.94,26,1581133718.0
"Another Climate Scientist with Impeccable Credentials Breaks Ranks: ""Our models are Mickey-Mouse Mockeries of the Real World""... “The global surface mean temperature-change data no longer have any scientific value and are nothing except a propaganda tool to the public.”",,do7tar,239,0.92,43,1572263781.0
How dare you,,122yfxs,234,0.76,151,1679862431.0
I hope Bill Gates uses only green energy for this event.,,q8tq8a,236,0.94,25,1634320440.0
Tell me again why I need to pay carbon tax?,,q869xz,230,0.95,102,1634237925.0
Rock-solid.,,eotbqh,236,0.9,26,1579043454.0
I'll teach those who refuse to believe,,kzu8c3,233,0.86,19,1610974871.0
.,,kqm8ss,232,0.93,60,1609806892.0
YouTube Star Asks Her Fellow Teenagers To ‘Think’ Before Jumping Aboard Greta Thunberg’s ‘Alarmism’,,fa178r,236,0.94,10,1582754648.0
What Climate Emergency?,,eet9q6,232,0.89,22,1577147318.0
"Without China, there’s no such thing as “climate change”",,e0cu1v,233,0.93,36,1574482337.0
Greenest country on earth,,pl52f3,233,0.94,16,1631216684.0
Climate Science Is Special,,gwme8y,234,0.9,99,1591293132.0
Update for the Polarized Cap. Don´t let the deniers take over with Fake Facts.,,fv2xrg,232,0.93,10,1586040222.0
"Banned from r/nature for disagreeing with the Global warming religion, thereby proved my point exactly",,dyfig3,235,0.93,72,1574138086.0
.,,kbzu8a,230,0.93,103,1607816992.0
Adjusting the correct wording.,,f8iyd9,232,0.9,91,1582505121.0
The Lefty's On Reddit are Out of Control,"So, there's this post on /r/philosophy and someone mention the words ""climate change denier"", which is a phrase I take intellectual exception to. I posted the following, rational response and had it censored. 

""This phraseology ""climate change denier"", is not only inaccurate, it is insulting. Nobody seriously denies that the climate is warming and nobody calls themselves a ""climate change denier"". That is a label given to people who are skeptical of the claims of doom and gloom made by the eco-warriors.

What is a matter of debate is whether the change is man-made and whether it is something to be alarmed about. Despite what some would have you believe, science is never settled and there are legitimate scientific reasons to question the consensus that the climate's change is anthropogenic in nature and that a crisis is imminent if not already happening.

There was a time when Eugenics was the consensus best way to improve humanity. Science is not done by consensus and skepticism is a fundamental part of science.

Using the word denier is not only inaccurate for the reason mentioned before, it is insulting because it tries to attribute the same negative feelings associated with holocaust deniers.

""The world is literally a greener place than it was 20 years ago."" This according to NASA. Worldwide, poverty is at all time lows. America—a large, high-tech country that accounts for about 25% of the global economy—is now generally using less of most resources year after year, even as its economy and population continue to grow. What’s more, the US is polluting the air and water less, emitting fewer greenhouse gases, and replenishing endangered animal populations.

The bottom line is that the climate change hysteria is not a science-based movement. It is a political movement. Scientist don't call skeptics of their science ""Heretics"". That is more the language of a religion than it is of science.""

FUCK the climate change alarmists.",f1sxv8,230,0.78,152,1581353025.0
No need for climate protests in China,,ecapq3,230,0.92,15,1576663676.0
😶,,12o6xge,230,0.94,46,1681648254.0
Prince Charles calls for green TAXES as he meets Greta Thunberg in Davos (after flying in on a private jet) and pitches radical new world economy to tackle climate change,,esj5ch,233,0.93,52,1579731079.0
Arson Is Not Climate Change,,elj11y,231,0.9,101,1578436473.0
"Climate alarmism, like all Leftist politics, begins and ends with the death instinct, a (usually) silent desire to return to the painless state of nonexistence and a profound hatred for human life.",,dwyb6g,233,0.9,171,1573858223.0
Windmill-feasibility,,fcnbf5,227,0.81,51,1583200948.0
Remember when people were freaking out about this. It fixed itself without people interfering hmmm,,dr8lc7,226,0.9,69,1572823248.0
Why Things Are Going Wrong,,moyuoc,226,0.9,78,1618173477.0
Scanning for straight-pipes,,eu0tpr,230,0.93,24,1580006207.0
"Prime Ministerial Candidate Maxime Bernier: ""Climate change is a fact that nobody denies. Only 15,000y ago, Canada was covered in ice. The climate always has and will continue to change. We don’t need to panic, kill our economy and transform our way of life to fight it. SUPPORT PPC COMMON SENSE""",,dg0epf,228,0.92,146,1570724474.0
"Socialism, Not Climate Change, Is the Real Threat",,ed8f0d,229,0.87,56,1576837599.0
Not a joke; Now Greta is stuck on the Sea because the next Globalist Climate Summit was moved from Chile due to protests against Carbon Taxes..,,dqaelm,225,0.93,70,1572642383.0
Funny and true,,nej8xi,227,0.92,50,1621265329.0
FLASHBACK: Jimmy Carter Predicts We Run Out of Oil By 2011,,djccv8,224,0.96,27,1571344744.0
Teen commits suicide over climate change - this is what giving a hysterical teen (Greta) a platform can lead to,,d9octx,224,0.86,70,1569525386.0
Experts Warn We Have Only 12 Years Left Until They Change The Timeline On Global Warming Again,,d0jfn6,228,0.95,15,1567789527.0
Treating the climate like a religion is nothing new,,cowmf6,226,0.9,51,1565529465.0
Hmmm...,,eu2jv8,222,0.88,29,1580015577.0
Carbon capture,,11c5ytn,226,0.85,91,1677388000.0
Everyone Drowned 21 Years Ago,,q9i861,221,0.92,96,1634410728.0
Reality is denying science and not listening to the experts.,,l9k7vc,222,0.95,36,1612122377.0
Wikipedia Co-Founder: Site's Neutrality Is 'Dead' Thanks to Leftist Bias,,gr96ci,223,0.94,28,1590539285.0
Garbage in - garbage out,,fcz90y,225,0.91,9,1583261137.0
Saw this and came here,,bpfkv5,221,0.95,62,1558028538.0
Sea Level Rise in California,,msdj3w,222,0.94,63,1618610241.0
"Found this at the Royal Tyrell Museum, gives some pretty good points.",,erzsvj,220,0.92,46,1579635595.0
