title,selftext,id,score,upvote_ratio,num_comments,created_utc
"""Climate Change"" is Bullshit. Why Politicized Science is Dangerous","# ""Those who can make you believe absurdities can make you commit atrocities""

# ---Voltaire

&#x200B;

**Imagine that there is a new scientific theory that warns of an impending crisis, and points to a way out.**

This theory quickly draws support from leading scientists, politicians and celebrities around the world. Research is funded by distinguished philanthropies, and carried out at prestigious universities. The crisis is reported frequently in the media. The science is taught in college and high school classrooms.

I don’t mean global warming. I’m talking about another theory, which rose to prominence a century ago.

Its supporters included Theodore Roosevelt, Woodrow Wilson, and Winston Churchill. It was approved by Supreme Court justices Oliver Wendell Holmes and Louis Brandeis, who ruled in its favor. The famous names who supported it included Alexander Graham Bell, inventor of the telephone; activist Margaret Sanger; botanist Luther Burbank; Leland Stanford, founder of Stanford University; the novelist H. G. Wells; the playwright George Bernard Shaw; and hundreds of others. Nobel Prize winners gave support. Research was backed by the Carnegie and Rockefeller Foundations. The Cold Springs Harbor Institute was built to carry out this research, but important work was also done at Harvard, Yale, Princeton, Stanford and Johns Hopkins. Legislation to address the crisis was passed in states from New York to California.

These efforts had the support of the National Academy of Sciences, the American Medical Association, and the National Research Council. It was said that if Jesus were alive, he would have supported this effort.

All in all, the research, legislation and molding of public opinion surrounding the theory went on for almost half a century. Those who opposed the theory were shouted down and called reactionary, blind to reality, or just plain ignorant. But in hindsight, what is surprising is that so few people objected.

Today, we know that this famous theory that gained so much support was actually pseudoscience. The crisis it claimed was nonexistent. And the actions taken in the name of theory were morally and criminally wrong. Ultimately, they led to the deaths of millions of people.

**The theory was eugenics, and its history is so dreadful — and, to those who were caught up in it, so embarrassing — that it is now rarely discussed. But it is a story that should be well know to every citizen, so that its horrors are not repeated.**

The theory of eugenics postulated a crisis of the gene pool leading to the deterioration of the human race. The best human beings were not breeding as rapidly as the inferior ones — the foreigners, immigrants, Jews, degenerates, the unfit, and the “feeble minded.” Francis Galton, a respected British scientist, first speculated about this area, but his ideas were taken far beyond anything he intended. They were adopted by science-minded Americans, as well as those who had no interest in science but who were worried about the immigration of inferior races early in the twentieth century — “dangerous human pests” who represented “the rising tide of imbeciles” and who were polluting the best of the human race.

The eugenicists and the immigrationists joined forces to put a stop to this. The plan was to identify individuals who were feeble-minded — Jews were agreed to be largely feeble-minded, but so were many foreigners, as well as blacks — and stop them from breeding by isolation in institutions or by sterilization.

As Margaret Sanger said, “Fostering the good-for-nothing at the expense of the good is an extreme cruelty … there is not greater curse to posterity than that of bequeathing them an increasing population of imbeciles.” She spoke of the burden of caring for “this dead weight of human waste.”

Such views were widely shared. H.G. Wells spoke against “ill-trained swarms of inferior citizens.” Theodore Roosevelt said that “Society has no business to permit degenerates to reproduce their kind.” Luther Burbank” “Stop permitting criminals and weaklings to reproduce.” George Bernard Shaw said that only eugenics could save mankind.

There was overt racism in this movement, exemplified by texts such as “The Rising Tide of Color Against White World Supremacy” by American author Lothrop Stoddard. But, at the time, racism was considered an unremarkable aspect of the effort to attain a marvelous goal — the improvement of humankind in the future. It was this avant-garde notion that attracted the most liberal and progressive minds of a generation. California was one of twenty-nine American states to pass laws allowing sterilization, but it proved the most-forward-looking and enthusiastic — more sterilizations were carried out in California than anywhere else in America.

Eugenics research was funded by the Carnegie Foundation, and later by the Rockefeller Foundation. The latter was so enthusiastic that even after the center of the eugenics effort moved to Germany, and involved the gassing of individuals from mental institutions, the Rockefeller Foundation continued to finance German researchers at a very high level. (The foundation was quiet about it, but they were still funding research in 1939, only months before the onset of World War II.)

Since the 1920s, American eugenicists had been jealous because the Germans had taken leadership of the movement away from them. The Germans were admirably progressive. They set up ordinary-looking houses where “mental defectives” were brought and interviewed one at a time, before being led into a back room, which was, in fact, a gas chamber. There, they were gassed with carbon monoxide, and their bodies disposed of in a crematorium located on the property.

Eventually, this program was expanded into a vast network of concentration camps located near railroad lines, enabling the efficient transport and of killing of 'undesirables'.

After World War II, nobody was a eugenicist, and nobody had ever been a eugenicist. Biographers of the celebrated and the powerful did not dwell on the attractions of this philosophy to their subjects, and sometimes did not mention it at all. Eugenics ceased to be a subject for college classrooms, although some argue that its ideas continue to have currency in disguised form.

But in retrospect, three points stand out. First, despite the construction of Cold Springs Harbor Laboratory, despite the efforts of universities and the pleadings of lawyers, there was no scientific basis for eugenics. In fact, nobody at that time knew what a gene really was. The movement was able to proceed because it employed vague terms never rigorously defined. “Feeble-mindedness” could mean anything from poverty to illiteracy to epilepsy. Similarly, there was no clear definition of “degenerate” or “unfit.”

Second, the eugenics movement was really a social program masquerading as a scientific one. What drove it was concern about immigration and racism and undesirable people moving into one’s neighborhood or country. Once again, vague terminology helped conceal what was really going on.

Third, and most distressing, the scientific establishment in both the United States and Germany did not mount any sustained protest. Quite the contrary. In Germany scientists quickly fell into line with the program. Modern German researchers have gone back to review Nazi documents from the 1930s. They expected to find directives telling scientists what research should be done. But none were necessary. In the words of Ute Deichman, “Scientists, including those who were not members of the \[Nazi\] party, helped to get funding for their work through their modified behavior and direct cooperation with the state.” Deichman speaks of the “active role of scientists themselves in regard to Nazi race policy … where \[research\] was aimed at confirming the racial doctrine … no external pressure can be documented.” German scientists adjusted their research interests to the new policies. And those few who did not adjust disappeared.

A second example of politicized science is quite different in character, but it exemplifies the hazard of government ideology controlling the work of science, and of uncritical media promoting false concepts. Trofim Denisovich Lysenko was a self-promoting peasant who, it was said, “solved the problem of fertilizing the fields without fertilizers and minerals.” In 1928 he claimed to have invented a procedure called vernalization, by which seeds were moistened and chilled to enhance the later growth of crops.

Lysenko’s methods never faced a rigorous test, but his claim that his treated seeds passed on their characteristics to the next generation represented a revival of Lamarckian ideas at a time when the rest of the world was embracing Mendelian genetics. Josef Stalin was drawn to Lamarckian ideas, which implied a future unbounded by hereditary constraints; he also wanted improved agricultural production. Lysenko promised both, and became the darling of a Soviet media that was on the lookout for stories about clever peasants who had developed revolutionary procedures.

Lysenko was portrayed as a genius, and he milked his celebrity for all it was worth. He was especially skillful at denouncing this opponents. He used questionnaires from farmers to prove that vernalization increased crop yields, and thus avoided any direct tests. Carried on a wave of state-sponsored enthusiasm, his rise was rapid. By 1937, he was a member of the Supreme Soviet.

By then, Lysenko and his theories dominated Russian biology. The result was famines that killed millions, and purges that sent hundreds of dissenting Soviet scientists to the gulags or the firing squads. Lysenko was aggressive in attacking genetics, which was finally banned as “bourgeois pseudoscience” in 1948. There was never any basis for Lysenko’s ideas, yet he controlled Soviet research for thirty years. Lysenkoism ended in the 1960s, but Russian biology still has not entirely recovered from that era.

Now we are engaged in a great new theory that once again has drawn the support of politicians, scientists, and celebrities around the world.

* Once again, the theory is promoted by major foundations.
* Once again, the research is carried out at prestigious universities.
* Once again, legislation is passed and social programs are urged in its name.
* Once again, critics are few and harshly dealt with.
* Once again, the measures being urged have little basis in fact or science.
* Once again, groups with other agendas are hiding behind a movement that appears high-minded.
* Once again, claims of moral superiority are used to justify extreme actions.
* Once again, the fact that some people are hurt is shrugged off because an abstract cause is said to be greater than any human consequences.
* Once again, vague terms like sustainability and generational justice — terms that have no agreed definition — are employed in the service of a new crisis.

I am not arguing that global warming is the same as eugenics. But the similarities are not superficial. And I do claim that open and frank discussion of the data, and of the issues, is being suppressed. Leading scientific journals have taken strong editorial positions of the side of global warming, which, I argue, they have no business doing. Under the circumstances, any scientist who has doubts understands clearly that they will be wise to mute their expression.

One proof of this suppression is the fact that so many of the outspoken critics of global warming are retired professors. These individuals are not longer seeking grants, and no longer have to face colleagues whose grant applications and career advancement may be jeopardized by their criticisms.

In science, the old men are usually wrong. But in politics, the old men are wise, counsel caution, and in the end are often right.

The past history of human belief is a cautionary tale. We have killed thousands of our fellow human beings because we believed they had signed a contract with the devil, and had become witches. We still kill more than a thousand people each year for witchcraft. In my view, there is only one hope for humankind to emerge from what Carl Sagan called “the demon-haunted world” of our past. That hope is science.

But as Alston Chase put it, “when the search for truth is confused with political advocacy, the pursuit of knowledge is reduced to the quest for power.”

That is the danger we now face. And this is why the intermixing of science and politics is a bad combination, with a bad history. We must remember the history, and be certain that what we present to the world as knowledge is disinterested and honest.

[https://www.thegwpf.com/michael-crichton-why-politicized-science-is-dangerous/](https://www.thegwpf.com/michael-crichton-why-politicized-science-is-dangerous/)

[**""The Arctic Ocean is warming up, icebergs are  becoming scarcer, according to a report to the Commerce Department,  within a few years it is predicted that due to the ice melt the sea will  rise and make most coastal cities uninhabitable.""----- November 2, 1922**](https://www.reddit.com/r/conspiracy/comments/c7148m/climate_change_is_bullshit_the_arctic_ocean_is/)",c7dejj,157,0.88,56,1561899909.0
"Upside down, Orwellian climate change madness in single headline. Make it make sense.",,11yxzo3,153,0.89,47,1679521807.0
They Just Want Everyone To ‘Believe In The Science’,,z9b1fl,152,0.84,211,1669860680.0
Everything Is Proof Of Global Warming,,rpcmuf,151,0.9,94,1640573004.0
Hm,,kq9nw3,154,0.91,11,1609770181.0
.,,kkq9e5,153,0.89,15,1609017861.0
"Fake News: Tasmania’s 200% Renewable Energy Vanity Project, 100% Dependent on Coal-Fired Power from Victoria",,fkuldx,152,0.93,11,1584556619.0
I found this sub because I’m tired of the climate change hysteria on the internet,"People online keep saying that the world is so screwed up because of the climate change, humans are bad and selfish, corporations are bad etc. Some people on Reddit have said it gives them depression. It’s some popular now to say no one cares about climate change. 

I guess I just don’t understand this type of thinking at all. I just don’t get or understand what people are so upset about that would cause them to say humans should become extinct. I’m just not sure what is causing people to be so mad and negative over nothing. 

Even if it is as bad as they say(I don’t think it is) I would want to enjoy life and be happy and not promote misery and self hate. Like I honestly think some people want to commit suicide over this I’m not even joking.",epyjm2,152,0.94,80,1579255988.0
"When somebody says they ""believe in science""...",,ctfbwu,153,0.88,64,1566385878.0
"Climate scam doom porn since the 1980s. ""If we don't reverse global warming by 2000, entire nations will be wiped off the earth!"" But the climate cult doesn't care. The end is always near.",,11xdvpn,153,0.78,60,1679397556.0
🌐,,11viuf5,148,0.87,40,1679225157.0
Meirl,,10iorod,152,0.9,4,1674407952.0
Shutting Down Nuclear Plants Risks ‘Greatest Loss of Clean Power In History’,,ncjvq5,155,0.97,10,1621028770.0
Joe Biden declares war on American jobs with far-left climate plan,,l6wkhx,149,0.9,43,1611840529.0
Saint Greta,,ka28z4,149,0.8,37,1607552906.0
Biden Suggested Jailing Fossil Fuel Executives to Fight Climate Change,,jkkaz4,150,0.93,21,1604010396.0
"“Hottest May on Record”. No surprise at all this was a lie. Yet more dishonesty produced for ""The Party"".","Less than a week ago, a regular “unfriendly” to this sub posted this article published by CNBC...

Earth has hottest May on record -    
[https://www.cnbc.com/2020/06/05/climate-change-may-2020-is-hottest-month-on-record.html](https://www.cnbc.com/2020/06/05/climate-change-may-2020-is-hottest-month-on-record.html)  

This claim was then repeated by the BBC, BBC Radio 4 to be precise. The source of this claim was the Copernicus Climate Change Service of the EU, which, for anyone with a critical thinking mind, would immediately raise a red flag. 

**Unsurprisingly, this article exposes the claim as completely false –**    
[https://notalotofpeopleknowthat.wordpress.com/2020/06/05/bbcs-fake-claim-about-hottest-may/](https://notalotofpeopleknowthat.wordpress.com/2020/06/05/bbcs-fake-claim-about-hottest-may/) 

From the article -    
I make no comment about the global numbers, but would simply point out that none of the official agencies have released their data for May. The BBC claim comes from Copernicus, the EU agency, not regarded as a reliable source. However, the BBC claim about the UK is hopelessly wide of the mark. According to the Met Office, last month was only the 15th warmest May since 1884, and was not even as warm as 1893 and 1911! 

[https://www.metoffice.gov.uk/research/climate/maps-and-data/uk-temperature-rainfall-and-sunshine-time-series](https://www.metoffice.gov.uk/research/climate/maps-and-data/uk-temperature-rainfall-and-sunshine-time-series) 

""Climate Science""? No. It's the ""Ministry of Truth"". They do nothing but engage in the manipulation and mutability of history via deliberate oversight and data tampering. Their role is producing propaganda for ""The Party"" (UN) via endless and all manner of dishonesty. Marketing lies is their business now, nothing more. Climate Science = The Ministry of Lies.",h8k8od,155,0.9,94,1592097427.0
COVID-19 Reveals Computer Model Projections Are Wildly Inaccurate,,gt4b4c,150,0.94,12,1590797216.0
"Britain's goal to be carbon neutral by 2050 risks the UK becoming even more dependent on China, Sir Iain Duncan Smith warns",,fzu8vd,152,0.94,14,1586686367.0
Software Glitch Reveals Greta's Dad is Behind Her Social Media Posts,,eo3gkv,149,0.94,21,1578918451.0
"Joanne Nova explains how climate alarmist energy minister wrecked Australia's power grid, depressed Australia's economy, and created widespread blackouts.",,e2s46r,147,0.94,24,1574912204.0
Clown World.,,yy4bgi,152,0.91,34,1668725947.0
I feel it’s time for the world to acknowledge the fact that severely mentally ill individuals have found their way into science and academia.,,wh083y,150,0.92,59,1659717958.0
Democrats Keep Getting Their Climate Change Doomsday Predictions Wrong,,mbgd64,153,0.92,32,1616510937.0
Wait?? There was climate change before cars and coal power?,,mb3edq,146,0.89,68,1616463229.0
All aboard the climate train - 2020 Edition,,gl1612,147,0.9,11,1589658838.0
Unbelievable: Scientists Claim Ice Locked Arctic Research Vessel is Evidence We are Unprepared for Global Warming,,fcku0o,150,0.93,25,1583190280.0
Jeff Bezos' $10bn pledge to fight climate change is slammed as a 'greenwash' by critics,,f603tu,152,0.97,40,1582064951.0
"This sub just passed the mark of 17,000 readers","I've been noticing the number increasing over the weekend, and now there it is, 17,013 as I write this post. 

Maybe CNN's ""climate town hall"" created more skeptics and they found us? =)",d1jq94,146,0.93,50,1567990637.0
"The Guardian. September 2012. Eleven years later and the lies, scare mongering and failed predictions just keep on coming.",,11hzkll,149,0.88,25,1677937796.0
Godfrey Bloom (UKIP) at the European Parliament,,tfjqee,149,0.88,31,1647443187.0
"Do not Ask, do not Think, Obey!",,s6bwm6,148,0.93,16,1642446310.0
Greta 2065,,rsae46,151,0.81,9,1640893676.0
"""Those who are certain."" A quote by Michael Crichton",,o3sna1,146,0.95,62,1624145686.0
Einstein Was Right,,o31cmj,150,0.83,28,1624053624.0
Global Temperature for the last 3200 Years,,hgynql,150,0.88,10,1593282387.0
"If COVID-19 Models Are Unreliable, What Does This Mean For Climate Models?",,fr0cl1,145,0.96,62,1585458447.0
Scientists change their minds AGAIN - methane isn't a problem now,,fa9mhg,146,0.9,32,1582795866.0
"National Park Begins Subtle Removal of ""Gone by 2020"" Signs After Glaciers Just Keep Not Being Gone",,bxtt68,146,0.93,63,1559909110.0
The new scientific method (borrowed from r/libertarianmemes),,104yfn5,148,0.85,136,1673022446.0
"There is no climate emergency, say 500 experts in letter to the United Nations"," 1 Natural as well as anthropogenic factors cause warming.  
2. Warming is far slower than predicted.  
3. Climate policy relies on inadequate models.  
4. CO2 is not a pollutant. It is a plant food that is essential to all life on Earth. Photosynthesis is a blessing. More CO2 is beneficial for nature, greening the Earth: additional CO2 in the air has promoted growth in global plant biomass. It is also good for agriculture, increasing the yields of crops worldwide.  
5. Global warming has not increased natural disasters.  
6. Climate policy must respect scientific and economic realities.  
7. There is no climate emergency. Therefore, there is no cause for panic. 

[https://www.aei.org/carpe-diem/there-is-no-climate-emergency-say-500-experts-in-letter-to-the-united-nations/](https://www.aei.org/carpe-diem/there-is-no-climate-emergency-say-500-experts-in-letter-to-the-united-nations/)",qbzk9y,151,0.91,39,1634732452.0
I don't have the words. (LinkedIn feed snapshot; poster / faces cropped for privacy),,p52tnd,148,0.97,16,1629065047.0
US Government Tries To Erase Historical Forest Fire Data To Fabricate Another Fake Crisis,,nv9gfn,146,0.94,43,1623173145.0
Concerned about Sea Level Rise?,,mo9ys7,151,0.92,20,1618078618.0
The propaganda campaign marches on,,ky6si3,148,0.8,43,1610753526.0
No one is fiddeling the data.,,e2k2rg,150,0.95,68,1574878400.0
Exactly.,,cihpfx,144,0.93,9,1564235318.0
"Earth is greener today than it was 20 years ago thanks to 'human activity,' NASA study shows",,aw7g39,150,0.96,25,1551461345.0
Hahahaha,,11sibpe,147,0.85,79,1678935792.0
"Here’s an aerial shot of a lithium field in northern Chile. The fields are so neuro-toxic that a bird landing on them will die within minutes. I wonder, is this what our puppet politicians and eco-fascists refer to when they say “clean, green energy”?",,wsbsjt,147,0.92,82,1660909172.0
Science®,,usohy7,147,0.83,28,1652912744.0
Very scientific,,rydg8m,147,0.91,57,1641578263.0
➖,,ojgvge,150,0.88,131,1626186927.0
.,,ksh79j,144,0.86,36,1610038196.0
"Retired NASA astronaut Chris Hadfield on Climate Change, ""...a huge amount of self-aggrandizing and self-importance and being chicken little.""",,eqke4x,146,0.95,19,1579373022.0
"Dirty Secret Behind Wind Turbines, They Need Lots Of Oil",,ejfupo,145,0.91,16,1578060525.0
Science is tentative,,ea9pfj,147,0.9,19,1576270393.0
Media Ignores Climate Alarmist’s Court Loss — It Doesn’t Fit The Warmist Agenda,,cxf09l,148,0.93,38,1567160598.0
"""Climate Change"" is Bullshit. The Governor of Oregon is using the ""Climate Change"" excuse to cripple entire industries and destroy thousands of families by eliminating good paying jobs.",,c9fp4o,148,0.9,21,1562331715.0
Unprecedented Climate Change,,y9yiuf,145,0.91,10,1666370951.0
Why does climate change spare California’s private forests?,,ithkr7,146,0.93,25,1600203612.0
The Oceans Aren’t 'Acidifying': The Term Is Just Being Abused by Science and Media,,h7870v,149,0.92,37,1591914745.0
“about New York’s insane decision to close nuclear power plants in favor of wind farms”,,g47smc,145,0.93,10,1587303486.0
"Global warming alarmists always say ""We should just trust the mainstream scientists & experts"". Here's my response...","We shouldn't blindly trust anyone, especially if their career & economic incentives depend on pushing an agenda.

We should trust proof.

- Mainstream foreign policy experts & intelligence experts can be wrong about Iraqi WMDs.

- Mainstream economists can be wrong about the effects of free trade, or whether there would be a housing crash.

- Mainstream scientists can be wrong about global warming, or whether the Earth orbits the Sun (pre-Galileo).

Also, global warming alarmists kept saying that we should believe the ""97% consensus"" study, and that the debate was over.

It turns out that the ""97% consensus"" global warming study was done by a **CARTOONIST** named John Cook, and many of the scientists quoted refuted his claims.

*""I'm not a climatologist or a scientist but a self employed cartoonist"" - John Cook*

- http://web.archive.org/web/20071213172906/www.skepticalscience.com/page.php?p=3

- http://web.archive.org/web/20080213042858/www.skepticalscience.com/page.php?p=3

- http://web.archive.org/web/20110515150022/http://wiki.sev.com.au/About-Us

- https://www.forbes.com/sites/alexepstein/2015/01/06/97-of-climate-scientists-agree-is-100-wrong/ 

Afterwards, global warming alarmists gave cartoonist John Cook a research job to give him some credentials, and he changed his website around, but the archive websites are forever.

---

NOTE: My argument above has been banned from r/climatechange TWICE.  I suspect that that sub is auto-banning comments with certain keywords, like ""cartoonist"".",er2cc1,146,0.84,97,1579468159.0
London anti-Trump protesters leave streets littered with trash and signs. These are climate crusaders?,,bx5bsw,147,0.9,24,1559755921.0
Climate Change over the next 20 years could result in a Global Catastrophe,,pouog4,145,0.91,28,1631726693.0
Texas blackouts may ‘never have occurred’ had there been more coal fired electricity,,m15abr,143,0.86,41,1615292493.0
thought this would fit here .,,ldn6ck,141,0.81,46,1612576455.0
Happy New Year!,,ko25pu,142,0.93,25,1609463391.0
"Recycling was a lie — a big lie — to sell more plastic, industry experts say...Less than 10 per cent of the plastics we’ve used have been recycled.",,j6u65t,142,0.95,21,1602088515.0
This is a response to Denver going from 92 degrees to snow overnight 🤷🏼‍♂️,,iooh83,146,0.91,49,1599545749.0
97% of Scientists believe.. What Exactly?,,g2mazu,143,0.93,61,1587066964.0
