title,selftext,id,score,upvote_ratio,num_comments,created_utc
"Prince Charles issues new 10 years to save the planet – He previously issued 18 month, 100 month, 35 year tipping points",,f8f09i,143,0.94,20,1582488565.0
Netflix and Attenborough are lying about those walrus suicides to due to 'climate change'. It's another 'tragedy porn' climate hoax,,f2lsch,145,0.91,10,1581483059.0
your opinion means very little to me,,d9jcok,146,0.88,19,1569503009.0
"The word “science” has lost its meaning. It’s just ideology. Like the climate scam, we see this everywhere. Same playbook.",,112x4cq,144,0.73,51,1676464900.0
That's bigger stretch than vagina during birth…,,ruj06b,144,0.91,21,1641156459.0
Mike Mann's Nature Trick To Hide The Decline,,qj84zw,144,0.94,53,1635620529.0
that flood in 1501 was a biggie,,osplhu,141,0.96,20,1627401360.0
Joe Biden accidentally tells the truth -- cutting US carbon emissions won't matter,,n2mlno,141,0.96,18,1619888984.0
New Study Finds A 79% Rise In Polar Bear Sightings Since 2005 As Their Arctic Habitat Dramatically Expands,,lpvycb,147,0.92,54,1614018734.0
.,,kt9285,142,0.89,72,1610132272.0
ALARMING: Coronavirus Being Used to FORCE the Green New Deal ON AMERICANS,,gz27xm,147,0.88,9,1591632658.0
Nobody expected 'very left-wing' Michael Moore to issue a film 'critical of renewables',,g9m7ll,143,0.96,31,1588076628.0
WHO Official Peddles False Pandemic Link to Climate Change,,g1uhxo,144,0.92,27,1586965659.0
"Climate Change is making pigs skinnier... also, Climate Change is making Horses fatter...!? (check out that absolute unit of a horse)",,ecwmrg,143,0.91,31,1576777634.0
"The United States broke 4,647 all-time low temperature records over the last 30 days, vs just the 1,022 max. In addition, 954 snowfall records were toppled. Data courtesy of warm-mongering, UHI-ignoring NOAA (makes me wonder what the 'true' data looks like). #GrandSolarMinimum",,e78bqj,140,0.95,32,1575684704.0
Trump’s Pentagon shuts down Obama-era Navy ‘Task Force Climate Change.’ Good.,,cwldc5,142,0.92,15,1567001571.0
Climate Activist Greta Thunberg’s Yacht Trip to America More Harmful to Environment Than Flying,,cr5cs0,141,0.94,89,1565956734.0
"I honestly feel for some of these people. They are living in a constant state of fear. Also western countries aren’t having enough kids to even sustain their populations, the majority of population growth for the next 100 years is coming from Africa.",,chc9hc,147,0.93,55,1563994243.0
"""... greatest threat of our time.""",,bt4odc,145,0.94,13,1558851212.0
.,,120r7pw,146,0.88,16,1679678348.0
"Heartbreaking message from a Dutch farmer: “Tonight was the last time we milked our cows. After 90 years, this is it for the organic dairy sector. We aren’t allowed to continue because we were labelled a ‘peak polluter’. “ Climate scam and the psychopaths.",,11nuqkv,143,0.86,39,1678468123.0
The End Goal of Net Zero...,,zcnrdl,142,0.9,18,1670192454.0
"""So the global warming scare is basically a hoax.""",,sta8la,143,0.88,65,1644951187.0
Men cause 40% more Climate Change than Women,,r1cbo9,143,0.91,60,1637780091.0
"Our climate czar, John Kerry, who is married to a billionaire... discloses millions in income from finance, energy firms",,n25pea,144,0.98,14,1619823822.0
"'No priority' for basic spelling as classrooms focus on climate change, BLM and gender fluidity",,mc40cq,145,0.93,39,1616587581.0
South Pole Warming Claims Contradicted by Actual Temperature Measurements,,hlr7li,141,0.96,11,1593972746.0
Climate Alarmists Knowingly Use False Advertising to Push Radical Action,,ffykp7,140,0.92,8,1583776067.0
What if higher CO2 concentrations are actually good for plant growth?,,f79wi5,140,0.91,82,1582285280.0
"Michael Mann, creator of the infamous global warming 'hockey stick', loses lawsuit against climate skeptic, ordered to pay defendant's costs",,cvfzi2,143,0.93,14,1566775712.0
"A graveyard for wind turbine blades. They have burial sites for dead, toxic solar panels too. And they call this ""green, renewable energy"". If only people knew.",,11ua1x9,143,0.67,223,1679101352.0
"“There’s a concern that if it turns out that CO2 is not a major cause of climate change, NASA will have put the reputation of NASA, NASA’s current and former employees, and even the very reputation of science itself at risk of public ridicule and distrust.”",,11rfbi9,143,0.79,172,1678837955.0
Telescreen weather propaganda. Look into my eyes. Look at my weather chart. Look into my eyes. cLiMaTe ChAnGe!,,w4xhw6,142,0.82,83,1658452769.0
"Look, its only worried kid from Sweden!",,q3rf9t,142,0.89,22,1633671721.0
🤭,,o40rc4,141,0.93,2,1624176921.0
"Here’s to global warming, I mean global cooling, I mean the hole in the ozone layer is going to kill us all, I mean climate change.",,muqhmv,143,0.88,39,1618925846.0
Get ready for the Great Climate Propaganda push of 2021,Post-Election and Covid news is winding down and behind the scenes the elites are planning to make climate fear the next big scare tactic to exploit. Sit back and enjoy the science-less debauchery. But dont let it run you over.,mqq8qn,142,0.93,113,1618405818.0
"My city just issued a “climate emergency” today. Meanwhile, our exploding homeless population is literally dying on the streets.",,et5d3b,141,0.94,19,1579840629.0
"Climate Propagandist gets schooled on basic science by MIT genius in audience. Crowd become furious about climate lies, hostess calls cops.",,d6e72a,138,0.93,41,1568900385.0
"""Species extinction is caused by people acting on irrational fears about climate change.""",,bqwdnp,143,0.9,34,1558363263.0
"What do you guys think about this? ""Deeper Ties to Corporate Cash for Doubtful Climate Researcher""",,2wpjpd,140,0.77,341,1424563584.0
"Climate Change is Ordinary and Cyclical, Not Catastrophic and Irreversible",,xx8w0f,141,0.87,88,1665072154.0
"If you look at the timelines for the last Ice Age and when it ended (12,000 years ago), it is apparent that humans did not cause the ice to melt. The earth naturally goes through drastic climate changes organically. Why does no one discuss this in the media?",https://gml.noaa.gov/outreach/info_activities/pdfs/PSA_ice_ages.pdf,rq0nra,142,0.95,85,1640648192.0
How To Spot Pseudo Science (11 Easy Steps!),,pw049a,139,0.96,72,1632683127.0
Funny How This Doesn't Apply To Hurricanes,,pss14v,140,0.91,41,1632258271.0
Has Climate Change Become a Tool of Social Control?,,n45soy,142,0.97,188,1620072132.0
"Stop Blaming Climate Change For California’s Fires. Many Forests, Including The Redwoods, Need Them.",,igh8yj,139,0.92,9,1598377967.0
Never Forget: It´s all about science!,,g9uoiy,143,0.96,29,1588105009.0
Should Nuclear energy be used to fight climate change?,,fwu5pq,142,0.9,44,1586298419.0
"John Cook is an absolute fraud. There is not, and never has been a consensus.",,ffur8d,141,0.92,71,1583760995.0
Germany Solar and Wind is Triple the Cost of France’s Nuclear and Will Last Half as Long,,duzg79,141,0.97,12,1573508069.0
Climate protesters ‘can’t make a point without carrying on like foul animals’,,dqjea1,142,0.87,31,1572697233.0
Accurate,,cd3lwe,141,0.94,3,1563114537.0
"USA is closing coal plants, why are other countries building them?",,12em4ie,141,0.82,149,1680875726.0
Global Warming: Facts versus Faith,,xy3lkh,141,0.81,93,1665160242.0
Problem solved,,toz81r,139,0.83,8,1648317956.0
Worse Than Katrina,,pg038j,137,0.94,21,1630521377.0
"Patrick Moore destroys climate cultists' narratives with facts. CO2 levels on earth at near all-time lows still. Increasing CO2 is actually increasing plant-life growth on earth. Ice age cycle is responsible for temp changes, not human activity. And more truth bombs.",,fqrkxx,142,0.9,29,1585426462.0
"3 billion years ago, the continents were covered in water. It must've been because of man-made global warming because there's no other explanation for fluctuations in landmass or weather. /s",,fczj3e,143,0.9,18,1583262178.0
How dare you! WOMP WOMP,,eg6rr3,141,0.93,19,1577423480.0
"New Report Reveals Climate Change Protesters Are Being Paid, May Be in Trouble Because of It",,dmes00,143,0.92,49,1571914955.0
"'Unfortunately, Scientific Fraud is Far More Prevalent than Commonly Believed—and Not Just in Climate Science.'",,1323wjk,143,0.72,182,1682703026.0
Mars Attacks!,,rmdkzh,139,0.93,69,1640203684.0
Bo knows,,qms6qe,139,0.97,18,1636053379.0
"Sea Level Rise in Miami, Florida",,mswx2z,139,0.91,33,1618686528.0
More Than 90% Of California Fires Are Man Made,,j3osrw,139,0.92,50,1601616212.0
"Michael Moore's documentary ""has exposed green energy as a fraud""",,iaguqb,137,0.91,24,1597530476.0
Greta Hectors Davos: Why Are Elitists Thrilled To Be Lectured By A Child Who Knows Nothing?,,esapga,138,0.87,34,1579692813.0
ok doomer,,dsjvv7,139,0.92,2,1573062689.0
"‘Trust the science’ is the most unscientific statement. Climate science is 33% sensational narrative, 33% money, 33% globalist ideology, and 1% science.",,11wb5io,136,0.84,85,1679294759.0
World leaders and globalist elites flying home after helping to save the planet from runaway greenhouse gas emissions at COP27.,,yqxz4f,138,0.94,26,1668033863.0
A perfectly valid statement.,,vn953s,134,0.9,62,1656484720.0
Intolerant Biden Refuses To Accept Climate's Decision To Transition,,l7zadx,140,0.87,11,1611943216.0
Laid-off Keystone XL worker shares his heartbreaking message for Biden,,l5cetg,137,0.9,63,1611661615.0
Banned The Trump. We're Next.,,kt7kuu,136,0.9,66,1610128092.0
Trudeau to miss 2020 emissions target by 99.2%,,jtdinw,139,0.97,13,1605255852.0
r/badacademia was banned,"Just read a post that a subreddit dedicated to exposing the biased and corrupt aspects of Western academia was banned recently.

Maybe time to make a backup-sub @ .win just in case ?",hki0ov,139,0.96,18,1593778522.0
"Chinese Scientists Conclude the Urban Heat Island Effect is responsible for much of the Observed ""Climate Warming""",,h0e3hz,137,0.93,32,1591805626.0
Wikipedia deletes The List of Scientists who are Skeptics of the sacred (fake) “Consensus”,,fhch5e,138,0.96,104,1583997264.0
"In every way they can think of, elites are trying to make ordinary Americans desperate about climate change, so they can wheel their Trojan horse full of policy proposals into the United States.",,fai4wb,139,0.95,8,1582834544.0
If ocean levels were really about to rise then banks wouldn't give out loans for coastal properties.,,d51c8w,136,0.94,28,1568643735.0
Scientific Method,,cue1ty,136,0.95,23,1566567651.0
Slight difference,I guess people kept leaving their fridge doors open in the 70s.,12vutnf,139,0.83,151,1682222407.0
Biden’s 75 car motorcade in Canada to address global warming,,121vdkv,135,0.85,40,1679770403.0
It’s weird how Scientific apocalyptic predictions are starting to sound like Biblical apocalyptic predictions 🤷‍♂️,,py5fws,139,0.95,20,1632951801.0
Is It Really A Climate Crisis When They Want It Both Ways?,,i3e5xv,139,0.91,42,1596522158.0
Climate Alarmists Invent New Fake Link to California Wildfires,,fvgx6t,135,0.94,35,1586105539.0
Climate Change Lawsuits Collapsing Like Dominoes,,fin06j,137,0.93,5,1584210647.0
Does Greta Thunberg’s Lifestyle Equal Climate Denial? One Climate Scientist Seems To Suggest So.,,dx64jy,138,0.91,40,1573906120.0
XR Activists “Please STOP Telling Children They May Not Grow Up” - Climate Change Is Serious But This Is NOT What The IPCC Say,,duuan0,134,0.94,32,1573487838.0
The Child on TV - Part 3,,dpjp86,134,0.73,46,1572503862.0
"Brendan O'Neill: Climate change ""These kids think they're being rebellious. They're conforming.""",,d6u8xa,135,0.88,68,1568982813.0
The Science Is Settled,,yhnm3z,137,0.78,171,1667158408.0
A tree wow,,wr1cuj,136,0.96,68,1660773314.0
The New Liberal Democracy,,vxfqq6,139,0.9,37,1657644415.0
Fact Check,,s9gxyz,136,0.91,2,1642788552.0
NASA says that CO2 is a coolant not a warming gas. One part of NASA is now in conflict with its climatologists after new NASA measurements prove that carbon dioxide acts as a coolant in Earth’s atmosphere.,,mkif89,135,0.88,64,1617622009.0
Should they be burning smoke flares?,,lv5vbd,135,0.9,18,1614594582.0
"Meet The 19-Year-Old 'Anti-Greta', Who Warns Thunberg's 'Alarmism' Must Be Stopped",,fcar7v,137,0.82,17,1583148705.0
"Global Warming Politics Are Dividing Us, Because That’s The Way The Alarmists Want It",,dwpjb8,137,0.9,13,1573817609.0
"If They Eat Only Their Own Kids I'd Call This Eugenics: ""Distraught woman at AOC town hall urges 'eating babies' to fight climate change""",,ddh7tf,138,0.91,36,1570241641.0
🤡 world,,1068gs6,134,0.88,35,1673148512.0
"What a surprise: In court filing, Facebook admits ‘fact checks’ are nothing more than opinion",,rd0z71,137,0.98,83,1639113045.0
The former Australian prime minister who signed the Paris agreement now wants to withdraw,,gn5q70,135,0.95,11,1589953995.0
The Northern Hemisphere is having one of its Snowiest Winters since Records began in 1979,,flyb08,137,0.93,29,1584723073.0
A Cause For Alarm?,,eqj3pw,135,0.98,30,1579367503.0
“No it only works on driveways.”,,ei8rsh,137,0.91,0,1577826042.0
Don't believe this particular woman,,diwn7f,133,0.91,9,1571263480.0
Same same but different,,d86cnj,134,0.84,23,1569244352.0
"The more you know, the less you worry about climate change",,12osvfc,137,0.89,82,1681686867.0
Same ol story for decades. We’re all gonna die in 5 years… and then nothing. Sounds like Al Gore.,,1229r5u,133,0.79,84,1679801546.0
"North Korea, the ""greenest"" country on earth",,u4r2gq,132,0.91,11,1650087761.0
What do you mean?? Of course it can fix itself... Pretty sure the climate has been changing for longer than we've been around..,,qg5mj4,132,0.92,43,1635252351.0
"Dr. Roger Higgs' Letter to John Kerry: ""Global Warming and Cooling mimic Sun's magnetic Activity, not CO₂""",,ozajzu,136,0.95,55,1628268563.0
Climate Shame,,ovwitq,133,0.92,28,1627839404.0
New evidence emerges to show that climate change is a criminal science fraud ring run by corrupt pseudoscience puppets,,jo6us6,133,0.93,14,1604530240.0
"Climate Change Is Here: It’s Going To Get Cooler, Says NASA",,jc6yht,134,0.91,77,1602841355.0
"Despite the Lies, the Spin, and the Propaganda, Antarctic Sea Ice is Growing - both Extent and Concentration Greater Now than in 1980",,hm8ha6,132,0.93,17,1594045171.0
"Statistically, errors are balanced out over time.",,gym8yj,132,0.89,5,1591569168.0
Sometimes... a meme can tell a thousand words,,eire2c,132,0.71,57,1577929814.0
Logix,,eghm3n,136,0.81,42,1577484019.0
Geologist Viv Forbes: ‘The CO2 scare is proving false – it’s time for some climate sense’ – UN seeks ‘fake answer to invented problem’ of ‘climate emergency’,,eek2f5,134,0.87,50,1577104403.0
Climate Change: Everywhere is Warming Twice as Fast As Everywhere Else!,,dnecho,137,0.93,14,1572099025.0
It's super weird how all the climate change solutions involve destroying the economy.,,b0rw9y,138,0.94,69,1552513895.0
"Eminent Oxford scientist says wind power will cost trillions, trash the environment and be entirely unnecessary.... as if we didn't already know.",,121kpqk,135,0.8,100,1679748092.0
"“As the world plunges ever deeper into the climate crisis” (quote from CNN article posted under comments), it’s funny how you never see Greta nor any Western nation calling out China for their actions. Something stinks to high heaven, and its name is #ClimateScam.",,11dqzbz,133,0.76,71,1677542083.0
"1000 private jets’ emissions are equivalent to 350 thousand cars. Of all these flights, 53 per cent were short-haul trips below 750 km that could have easily been made by train or car. Of these, 38 per cent were ultra-short distances of under 500 km. The shortest flight recorded was only 21 km.",,10h6zfb,135,0.95,22,1674245774.0
"‘Net Zero is a political command-and-control project, the full horror of which is yet to be inflicted on the general population.’ Report under comments.",,yb2b1w,133,0.91,40,1666482356.0
"One would think that's Good News, right?",,tbv73a,130,0.9,91,1647019767.0
“Global warming” is out. “Climate catastrophe” is in.,,raksh4,133,0.95,25,1638833097.0
Follow the Science!,,q678vk,131,0.9,43,1633990463.0
"Another Tesla owning ""socialist""",,nuwbyf,133,0.94,75,1623126669.0
Heat Waves in the US 1895 - 2020,,nd82eb,131,0.95,107,1621111520.0
"Physicist William Happer: ""There is NO Climate Emergency ... Renewable Energy is the inverse Robin Hood Strategy ... doubling CO2 makes no Difference""",,n6bs4f,135,0.93,39,1620319836.0
14 State Attorney Generals Tell Biden They’re Reviewing Legal Options Regarding Keystone XL,,lh0moa,129,0.95,33,1612982928.0
It's so sad that this is real,,i76iym,134,0.9,69,1597071998.0
"The lead author of that old ""97% of scientists"" paper used to have this in his site bio",,hu412s,136,0.92,36,1595178898.0
Reformed Climate Activist Condemns ‘Terrorizing School Children’ With Fake Science,,hk5h1q,130,0.94,61,1593724104.0
"New Toyota Prius Will Remind You To Check Your Privilege Every 3,000 Miles",,fbexv1,134,0.88,1,1582993766.0
Natural gas is crushing wind and solar power — Why isn't anyone talking about it?,,f9d0xy,131,0.95,28,1582648973.0
What kind of “Scientists” are warning of a Climate Emergency?,,dz1ow0,132,0.92,23,1574254526.0
Too good not to share,,dcaifg,134,0.91,22,1570024425.0
The climate protester in its natural habitat looks just like I imagined,,dbbqep,132,0.86,77,1569850908.0
"So, we cut down trees to make way for windmills, we turn the trees into wood pellets, we sell the wood pellets as “biofuel” to burn in power stations and tell them we’re saving the planet.",,125m1re,133,0.86,47,1680091294.0
Setting Priorities,,t0mhtj,132,0.89,25,1645739631.0
"Trains for Thee, Planes for Me",,qlcfrb,131,0.97,6,1635882247.0
"Eisenhower Also Predicted Fake Science, Virus Lockdowns, Big Tech, and Leftist Colleges",,nksk2u,134,0.99,25,1621956850.0
48 Of 79 ‘Catastrophic Climate Change’ Predictions Have Failed…The Other 31 Just Haven’t Expired Yet,,mmu7cz,134,0.93,26,1617895556.0
.,,kx8zkd,134,0.85,10,1610641693.0
"NASA's James Hansen, 1989: ""New York City’s West Side Highway will be Underwater by 2009""",,joncvt,130,0.97,17,1604598637.0
The horror of having someone who listen to Greta,,fi2thh,136,0.85,43,1584118650.0
"This video is remarkable, asked about US a greenhouse gas emissions compared to China, Michael Bloomberg goes into a full throated defence of the regime in Beijing on the environment, on their lack of democracy. I can’t believe how bad this is.",,e44fil,136,0.97,14,1575151948.0
BBC’s One Planet falsely claims that polar bears hunting whales from shore is an unprecedented effect of climate change,,e41nf3,133,0.96,29,1575141036.0
"Trust ""The Science""!",,rk1q18,130,0.93,47,1639935980.0
"Guess who! - ""YouTube needs to take action here""",,rbyglq,127,0.96,61,1638990359.0
Man Made CO2 accounts for 3% of total carbon dioxide levels on Earth.,,oxmgqp,130,0.86,114,1628057613.0
"A shame, wanted to visit the Maldives once👀",,ob70fb,132,0.96,34,1625088467.0
Caution! Greta Post: China Suggests Greta Thunberg is an Ignorant Political Puppet,,na9p0y,135,0.89,16,1620772387.0
"Biden Actions on American Oil, Gas Could Kill 1 Million Jobs",,l481w9,131,0.9,33,1611523585.0
.,,kasdxi,128,0.88,97,1607649356.0
"NPR: “Mounting Evidence” Suggests Just Like Climate Change, COVID19 Not As Deadly as Thought.",,i3pzor,130,0.84,94,1596569429.0
In Memoriam,,gamcun,128,0.88,4,1588210294.0
Australia’s Completely Nuts: World’s Third Biggest Uranium Exporter Maintains Ban On Nuclear Power Generation,,ffyp8j,133,0.93,22,1583776520.0
This is the worst case of Climate Cultism I’ve ever seen: “Climate scientists are literally in therapy because of their work and calling for worldwide civil disobedience” (+568) r/worldnews,,drhexh,133,0.94,29,1572873083.0
'Zero-carbon' yacht trip to UN exposed as fraud with problematic plane rides,,cxy7ld,131,0.9,23,1567273099.0
"Greenland’s all-time record temperature wasn’t a record at all, and it never got above freezing there. – the data was wrong",,cpwbjo,131,0.92,22,1565717094.0
Chinese research finds no evidence of human influence on the climate and sheds light on 500-year Chinese weather cycle suggesting a cool change could be on the way,,cpitkg,130,0.88,41,1565644895.0
"The Great Reset, aka The Great Leap Forward 2.0, takes another tyrannical step backwards. The Netherlands is the second largest food producer in the world. This policy has only one goal in mind: Global food shortages > starvation > depopulation. Link under comments.",,135mkgw,132,0.83,61,1683037199.0
All Animals Are Equal But Some Are More Equal Than Others,,ym8uoa,128,0.93,4,1667592230.0
Shit just got real,,uhr07v,131,0.79,92,1651614745.0
💉 😟 💔 😵 ⚰️ 🧟,,qtwmd7,131,0.94,49,1636916167.0
Quitting due to censorship,"It's with regret that I'm terminating my Reddit account. This was the sub I was most active in, so seems the appropriate venue to post this. While I did not personally suffer censorship here, it has come to my attention that, like an ever-increasing number of sites, Reddit values political correctness over freedom of speech. I refuse to participate in any forum that muzzles its users. All the same, thank you Reddit for providing the forums.",pgr52s,130,0.95,43,1630618041.0
Climate change cultist protester in Australia,,p1h4vf,129,0.92,36,1628566067.0
"NASA At It Again. Caught Adjusting Temps, Which is Scientific Fraud, to Enhance their False Model.","The key to good science is honesty. Feynman, Niels Bohr, Einstein, and many other great men of science stated that. To report as accurately as possible what is being seen. ANY breakdown of that method is dishonest, fraud, and disqualifies the person or group as not scientific, not trustworthy, and not ethical.

https://electroverse.net/nasa-caught-adjusting-global-temperature-graph/

As PM Lee Kuan Yew of Singapore once so wisely universally stated, one of the great men of our era: ""Trust is a very slender thread, and if broken is very hard to put back together.

Infocriminals all, like the Madia. This has been their undoing. Liars, deceivers, and corruptors of the truth go straight to the pits of hell, of their own creation, by their own evil deeds.

Then wonder why no one trusts or believes them any more. Universe of events enforces ethical behaviors and ruins those who violate those great, nearly universal truths.

Shame on the LOT of them!! They will be defunded & ruined.",oo4mu9,130,0.92,53,1626795918.0
"UN Loses Mind: Covid-19, Climate Change and Racial Justice are all Linked",,ha8z7d,129,0.9,19,1592330012.0
Coronavirus impact: ‘Expect more governments to abandon climate and emission targets to save their economies’,,fl3sh2,132,0.95,20,1584591550.0
Climate Change Lies from Famous Hollywood High School Dropouts,,et9ktj,129,0.89,18,1579867817.0
Republicans Will Live to Regret Joining Climate Alarmists,,e4oxbk,131,0.91,13,1575239115.0
AOC: Miami Will Not Exist 'In a Few Years' Without Green New Deal,,d3thug,131,0.91,43,1568399547.0
Google Insider Turns Over 950 Pages Of Docs And Laptop To DOJ Accusing Google of Algorithm Manipulation and Bias,,cq9l85,130,0.94,26,1565788911.0
Al Gore said our children wouldn’t see snow by 2020,,12cnhvj,130,0.74,136,1680707539.0
Lies for $500 Alex,,11prvpi,129,0.82,41,1678659914.0
"Wow such advanced tech, what's next a motorcycle without an engine powered by circular leg movement?",,q8dnxd,128,0.94,24,1634261693.0
I can’t decide what’s more pathetic: Thinking the Paris deal would do anything or thinking China would abide by it.,,muc9a4,130,0.91,17,1618871189.0
Scientists: No Correlation Between Climate Change And Wildfires In California – Or Anywhere Else On Earth,,iuo6nk,128,0.93,19,1600363830.0
"Humans do Ultimate Paris Lockdown, CO2 hits record high anyway",,gxc2nj,128,0.9,37,1591387927.0
They are pushing Full Marxism on your kids,,g4fl1v,132,0.9,30,1587330848.0
"Global Warming; 31,487 Scientists say NO to Alarm (2014)","[https://www.youtube.com/watch?v=eiPIvH49X-E&list=PLcQaEmYi\_DzTVwTF-KpcpVsstjMCtgoya&index=668&t=0s](https://www.youtube.com/watch?v=eiPIvH49X-E&list=PLcQaEmYi_DzTVwTF-KpcpVsstjMCtgoya&index=668&t=0s)

The Global Warming Petition project; Started by Dr Art Robinson in response to the false alarm over CO2; [http://www.petitionproject.org/seitz\_...](https://www.youtube.com/redirect?v=eiPIvH49X-E&event=video_description&q=http%3A%2F%2Fwww.petitionproject.org%2Fseitz_letter.php&redir_token=JRo_yODQ--py4-nXCJ9PaJBD3hR8MTU4MzYwMzg1MEAxNTgzNTE3NDUw) and [http://www.petitionproject.org/index.php](https://www.youtube.com/redirect?v=eiPIvH49X-E&event=video_description&q=http%3A%2F%2Fwww.petitionproject.org%2Findex.php&redir_token=JRo_yODQ--py4-nXCJ9PaJBD3hR8MTU4MzYwMzg1MEAxNTgzNTE3NDUw) Was signed by 31,487 scientists (in the USA alone) list here; [http://www.petitionproject.org/signer...](https://www.youtube.com/redirect?v=eiPIvH49X-E&event=video_description&q=http%3A%2F%2Fwww.petitionproject.org%2Fsigners_by_last_name.php%3Frun%3Dall&redir_token=JRo_yODQ--py4-nXCJ9PaJBD3hR8MTU4MzYwMzg1MEAxNTgzNTE3NDUw) they all say that there is no cause for any alarm over our CO2 emissions.",fehc2n,131,0.93,55,1583517608.0
Official Data Reveals the U.S. has Broken more All-Time Low Temperature Records than Maximums (so far) in 2019 - Electroverse,,d38m4x,126,0.93,36,1568298134.0
