id,subreddit,title,author,url,selftext,score,num_comments,created_utc
dshmwf,climate_science,Some help sought for a climate change denier?,sobrique,https://www.reddit.com/r/climate_science/comments/dshmwf/some_help_sought_for_a_climate_change_denier/,"Apologies if this seems a little lazy - I am trying to convince a person that climate change is an issue. Their assertions are:

- it's not clear that the temperature is rising. Temperatures have been high in the past (when dinosaurs were about).
- even if it was, 2 degrees doesn't seem much, and I don't see how it will affect me. 
- you are all being dramatic about a climate emergency, and it doesn't help. (E.g. because nothing serious has happened in the last 40 years, nothing is likely to happen in the next)

Would anyone be able to point me at something robust I can use to refute these arguments? 

I have been looking for myself, but have realised I am similarly a bit biased - I am convinced there is a problem, and see things that support that. But not to the standard that ""it will all be fine"" will accept.",10,33,1573053205.0
btxpks,climate_science,"'40 New Scientific Papers Disprove Climate Change... etc etc.' I suspect this is nonsense, but how do I interpret these studies cited?",BreaksFull,https://www.reddit.com/r/climate_science/comments/btxpks/40_new_scientific_papers_disprove_climate_change/,"My mother recently posted [this](https://newspunch.com/40-scientific-papers-global-warming/) link on Facebook to an obviously hack partisan website purporting that a bunch of 'new' scientific studies show there is no global warming. She's confused about it and I want to break it down for her, but unlike William DaFoe I'm not something of a scientist myself, and have a hard time divining exactly what some of these studies mean in the context of global climate change.

For example they link [this study](https://www.the-cryosphere.net/12/39/2018/tc-12-39-2018-supplement.pdf) which apparently shows that Greenland is no warmer currently than it has been in the past century, and [this](https://www.nature.com/articles/s41598-018-19992-w) which allegedly claims Greenland has experienced cooling in the last fifteen or twenty years. The [abstract here](https://www.clim-past-discuss.net/cp-2017-160/cp-2017-160.pdf) claims that temperature changes in NW Europe we see now are not out of line compared to Roman Warm Period and Medieval Climate Anomaly.

How do I interpret these findings? What do they actually mean in the context of global warming?",38,33,1559033995.0
dr2oy4,climate_science,How should one approach one's own actions in order to prevent climate change?,TheGroovyChili,https://www.reddit.com/r/climate_science/comments/dr2oy4/how_should_one_approach_ones_own_actions_in_order/,"Everywhere I read vague stuff like ""we need to eat less meat"" and ""we need to fly less"". I'm having a hard time actually getting some kind of a quantification on things like these, in order to know where I stand.

Somewhere I read that, by 2050, each persons emissions (CO2e) have to be around 1 or 2 tons per year. A roundtrip flight between Sweden and Spain accounts for 1 ton of emissions per person. That's about the entire yearly budget. And say for instance me living in Sweden and wanting to visit America. I can't do that by train.

Then there's also the food. A vegan diet accounts for about 0.5 ton of emissions per year. That's also a huge part of the yearly budget.

It's things like these that make me think we're fucked. There's no way we're going to stop all of the worlds people from flying and beginning a vegan diet. If we're not necessarily fucked, why?

And can you provide some kind of resource/book with data so that one can calculate and manage one's own emission budget? If possible, I'd like to eat meat, and travel.",25,20,1572798329.0
9qir3o,climate_science,Is there any actual scientific debate against climate change?,monkeychess,https://www.reddit.com/r/climate_science/comments/9qir3o/is_there_any_actual_scientific_debate_against/,"I'm an engineer and frequent a technical forum eng-tips.com. Recently a few posts there have spawned climate change debates and honestly I've been surprised how many people with strong technical backgrounds refute the science and claim it is literally a massive conspiracy.  
  
One common theme is that ""science"" is being manipulated by politics to push reports/studies for climate change to line the pockets of people in the business of dealing with pollution.
  
Another one is that essentially ""there is no scientific consensus on climate change and scientists who speak against it are pushed out"".
  
Based on some cursory research it appears that this is much impossible to defend. Yes, companies involved in technologies to combat pollution will make money. The scientific community appears to be united numerous nations have agreed that it is an issue. How can people really say the data is fake or misrepresented and nothing is happening?",35,48,1540247366.0
bhdon9,climate_science,Educating a climate change denier... Any resources would be helpful! (Crosspost to gather as much info as possible),throwaway136900,https://www.reddit.com/r/climatechange/comments/bhdeab/im_interested_in_informing_a_climate_skeptic_any/,,16,39,1556225266.0
lu07ay,climate_science,Impacts of climate change on oceans and marine life,berlioz1982,https://www.needforscience.com/biology/impacts-of-climate-change-on-oceans-and-marine-life/,,20,0,1614469047.0
ivdhsk,climate_science,Leveraging cognitive consistency to nudge conservative climate change beliefs: Conservatives and Liberals share a common belief in science. Conservatives believe in climate science more after reporting that they believe in science. A common belief in science may provide a promising starting point,nnomadic,https://www.sciencedirect.com/science/article/abs/pii/S0272494418302433?casa_token=8ZOcktiDkLgAAAAA:416ttadpsLQ8vguQRCG2RzGALM4qRpiXc1QNTXmEgC-jHsIcHUhxYQSon5w6JNc7O7TudxqWKA,,24,3,1600459563.0
emctjg,climate_science,Looking for info for Masters in anything related to climate change,allcoolhandlestaken,https://www.reddit.com/r/climate_science/comments/emctjg/looking_for_info_for_masters_in_anything_related/,"Hi everybody, I am computer science graduate and looking for masters degree preferably in Canadian or Europian universities that would help me understanding climate change better and possibly use my knowlegde of computer science, mathematics and data analysis to contribute knowledge to the field. I could only find a few until now McGill's AOS department, ETH Zurich, University of Bern. Any help is appreciated.",13,13,1578590699.0
izslv3,climate_science,Anyone have any links to studies that say US taking action could reverse the damage from climate change catastrophies?,lymeguy,https://www.reddit.com/r/climate_science/comments/izslv3/anyone_have_any_links_to_studies_that_say_us/,"To put it simply, I see pushback from some conservative people who say there isn't evidence that the US taking climate change seriously could prevent where it's already going.  

IE spend lots of money to prevent the earth from raising a half a degree or more over the coming years. 

Does anyone have any thoughts on this?  Are there some studies that suggest we can in fact mitigate climate risk in the US (factoring in places like Russia and China who also don't appear to take it seriously at all)?

Thanks",5,5,1601069801.0
dt2h3r,climate_science,What Are The Facts of Climate Change,Tucktuck24,https://www.reddit.com/r/climate_science/comments/dt2h3r/what_are_the_facts_of_climate_change/,"It seems most people’s opinion on climate change is formed entirely by their political philosophy and not by scientific research, regardless of which side they fall on.

I am no scientist myself, but I know something about this all, I’m just looking for some numbers to do my own math with.

How many ppm (parts per million) of CO2/other harmful gases are naturally in our atmosphere, how many are there now, how many exactly are produced by human activity, and at what rate does adding ppm increase earth’s temperature?",13,17,1573153621.0
cnjnf1,climate_science,IPCC Special Report on Climate Change and Land | Summary for Policy Makers,DungeonMastered,https://www.ipcc.ch/site/assets/uploads/2019/08/4.-SPM_Approved_Microsite_FINAL.pdf,,40,12,1565258890.0
km5bxb,climate_science,"A wide-ranging collection of journal entries and articles supporting the obvious conclusion that climate change is man-made (for discussions, if you ever need it)",altaccountsixyaboi,/r/UnpopularFacts/comments/klt1uz/manmade_climate_change_is_happening/,,32,0,1609210013.0
cupa3l,climate_science,climate change articles??,fromthatrock,https://www.reddit.com/r/climate_science/comments/cupa3l/climate_change_articles/,"ok so i do believe in climate change, but i’ve also only ever heard facts about climate change. i’ve never actually read anything. i was wondering if someone could link me to some peer reviewed articles explaining the reason for climate change and the effects all with data and math backing it up.",18,16,1566623180.0
l3i0zt,climate_science,Insects and recent climate change,burtzev,https://www.pnas.org/content/pnas/118/2/e2002543117.full.pdf,,19,0,1611428425.0
mg2rjt,climate_science,Climate Change Video Project Ideas,Neku88,https://www.reddit.com/r/climate_science/comments/mg2rjt/climate_change_video_project_ideas/,"For a class I'm currently taking on educational media design, our current project entails making a 1-2 minute video meant to change the viewer's thinking and/or behavior around climate change. This can include information about climate change itself, or something tied to a specific change related to climate destruction (e.g. reduce waste)

I have a ton of different topic ideas, and I was hoping to get an idea of what others think might be a good choice: 

Option 1) A video on bidets. Pros: potential for humor, informative for other Americans who don't know much about bidets, saves paper

Option 2) A video on moving from being interested in participating in advocacy around climate change to actually participating. This came from a recent survey report from a center at Yale that indicated that only 1% of Americans have participated in something like that, despite 30% saying that would like to.

Option 3): A video on climate change anxiety in millennials and younger. Relatable. 

Option 4): A video about the Green New Deal (could be tied to the advocacy video)

Options 5) A video about the massive (estimated) impact on having kids on one's carbon footprint. Could emphasize importance of considering adoption or foster care instead of having kids 

Option 6) a video about climate change action distractions. Pros: rhymes and could touch on why the straw bans were more of a distraction and harm to disabled folx than an environmental benefit. 

Option 7) A video reframing carbon footprint as an annual carbon ""budget"" that folx are in debt too. Pulls on concept of using up resources each year faster than the earth can renew them. 

Option 8) How to take with climate change deniers. This is a hard one, but close to home thanks to some family members. 

Thoughts? I'm mostly looking to get a sense of what people think would 1) be interesting and 2) potentially change thinking or behavior.",6,1,1617061294.0
errgoa,climate_science,Climate Change Preparation Sub,Sirfluffkin1,https://www.reddit.com/r/climate_science/comments/errgoa/climate_change_preparation_sub/," I've created a new sub, [r/ClimatePreparation](https://www.reddit.com/r/ClimatePreparation/) , which I think a lot of you might be interested in. It deals with preparing for climate change at an individual level. 

You guys are very knowledgeable on the science of climate change, which is what I am looking for in this sub.

Tell me what you think!",26,6,1579592928.0
jyha2t,climate_science,Climate Change Is Making Winter Ice More Dangerous: A new study has found that cold-weather drownings are increasing sharply in warmer parts of the Northern Hemisphere.,yayforjay,https://www.nytimes.com/2020/11/20/climate/thin-ice-winter-drowning.html,,30,0,1605988255.0
hxmsby,climate_science,How will climate change affect winter storms and swell?,bottles24,https://www.reddit.com/r/climate_science/comments/hxmsby/how_will_climate_change_affect_winter_storms_and/,"

I asked a similar question in r/surfing a couple of months ago:

How will the pole‘s ice melting affect the low pressure systems, known in the surfing world as ground swell( huge storms traveling between 30 degrees latitude and 60 degrees latitude),especially in the northern hemisphere?

With the ice of the poles melting, the temperature difference between the poles and the mid lattitudes in the air will likely decrease. This will in turn produce less big storms in Winter, which will ultimately produce less ground swell all around the world, but in particular in the northern hemisphere. Here the ice is melting first. 

That’s what i think could be happening. I read articles that stated storms will get more extreme. But i think that is only true for tropical storms. 

What do you think?
How will this affect the waves and Surf all over the world? In particular Europe and Northern America ? Do you agree with my hypothesis?
I for my part could imagine, we will not be able to see a change happening in the next 10-20years, but ultimately groundswells will get weaker over time. Cyclones and warm weather storms might occur more frequent.",8,4,1595684014.0
c7pi1w,climate_science,Any public models of climate change?,jerelo,https://www.reddit.com/r/climate_science/comments/c7pi1w/any_public_models_of_climate_change/,"I’m looking for publicly available models of climate change. Could be on a web site, or in an app. 
Hoping to discover a range of models from simple to complex. 
It would be great to be able to see models portraying the carbon budget for a 2 degree future, and how factors like sequestration and CO2 generation result in heating effects. I realize public models may be less sophisticated, but it seems reasonable that models might exist to demonstrate current knowledge.

If you know any models, please post links to follow up. Thanks!",11,18,1561965345.0
