id,subreddit,title,author,url,selftext,score,num_comments,created_utc
rve2jr,climate_science,Seeking understanding of human impact on climate change,Yliche3,https://www.reddit.com/r/climate_science/comments/rve2jr/seeking_understanding_of_human_impact_on_climate/,"Let me preface to say that I'm not in a science field, and that I'm in a tech field. I'm extremely pro-science and analytical. I don't think based on emotions at all and am here to genuinely learn from individuals more intelligent than me on this topic. I also trust that humans are impacting the climate.

&#x200B;

My main question is, how do we know how much impact humans are having on the climate. Not whether we are, or are not...but by how much.

I've seen the NASA graphic that shows how much more CO2 is in the atmosphere over the last 50 years, but are we using a different form of measurement in modern history versus how we speculate/measured it over generations before which could learn to large margins of error? This is possibly not true at all, but these are the types of questions I'm seeking to understand.

Also, I'm under the impression that other major climate changes were due to variations in orbit and so therefore there are other potential impacts on climate change outside of CO2. This would put some level of uncertainty on what magnitude of impact we have on climate change due to other outside factors?

&#x200B;

I assume there is not an exact amount that we can correlate human impact to climate change, but I'm curious at what level of certainty are we with what level of magnitude? Are we 99% certain that we are the cause for 75% of the temp increases, etc.? I assume that confidence level diminishes the higher we hypothesize the impact.

&#x200B;

Any insight would be great! Or if I need to move to another area for understanding, let me know!  


Edit: I must have missed some of this info. [https://climate.nasa.gov/causes/](https://climate.nasa.gov/causes/)  
This has some of this to an extent.",35,23,1641249287.0
5g7ug5,climate_science,Abrupt reorganization of North Pacific and western North American climate during the last deglaciation,Tommy27,http://onlinelibrary.wiley.com/doi/10.1002/2016GL071244/full,,4,0,1480738740.0
pk38l0,climate_science,Seeking resources on climate change denial,sadgreeksalad,https://www.reddit.com/r/climate_science/comments/pk38l0/seeking_resources_on_climate_change_denial/,"Hey everyone! I hope this is an appropriate ask for this sub but if not, feel free to remove. I’m a Communications student tasked with developing a persuasive campaign to convince climate change deniers to change their attitudes on the existence of climate change. I’m wondering if anyone has any recommendations for research sources that explore what populations in the US are most likely to disbelieve climate science and the reality of climate change caused by human activity. I’m interested in demographics like age, race, gender, location, political affiliation, etc. Peer reviewed journal articles & credible sources only, please!

UPDATE: Wow, thank you everyone for your thoughtful posts! I can’t respond to everyone (v busy grad student) but I really appreciate the time you’ve all taken to answer.",101,53,1631074281.0
vff0ix,climate_science,The Impact of Climate Change on Our Mental Health,ezikler,https://www.fikrikadim.com/2022/06/18/the-impact-of-climate-change-on-our-mental-health/,,26,0,1655585348.0
utmh8y,climate_science,We’re likely discounting the negative effects of climate change on the biosphere… by a lot.,salynch,https://www.newsweek.com/colorful-bird-famously-featured-lion-king-nearly-going-extinct-1708288,,69,1,1653025551.0
v0vlla,climate_science,Mathematical modeling of climate-change risk for banks,obovoc,/r/mathematics/comments/v0vgaz/mathematical_modeling_of_climatechange_risk_for/,,41,1,1653899410.0
s1n5zv,climate_science,Scientists call for a moratorium on climate change research until governments take real action,Levyyz,https://phys.org/news/2022-01-scientists-moratorium-climate-real-action.html,,43,10,1641934100.0
urzz1z,climate_science,Global Agricultural Water Scarcity Assessment Incorporating Blue and Green Water Availability Under Future Climate Change,burtzev,https://agupubs.onlinelibrary.wiley.com/doi/10.1029/2021EF002567?m,,35,0,1652832068.0
p1lkyg,climate_science,Can someone assist me in understand / debunking this paper claiming climate change is caused by the sun?,utopian_potential,https://www.reddit.com/r/climate_science/comments/p1lkyg/can_someone_assist_me_in_understand_debunking/,"A climate denier sent me a link to this  


""How much has the Sun influenced Northern Hemisphere temperature trends? An ongoing debate""

[https://iopscience.iop.org/article/10.1088/1674-4527/21/6/131](https://iopscience.iop.org/article/10.1088/1674-4527/21/6/131)

Im not going to pretend I am literate enough to understand the nuts and bolts of it. So I come here to you all whom have previously been amazing in explaining things to me.

&#x200B;

Is there a counter or a flaw, or is this new evidence (seems unlikely to me).

Thank you for your time.",56,39,1628586669.0
oq9a44,climate_science,What are the best climate change documentaries?,dorianaskew,https://www.reddit.com/r/climate_science/comments/oq9a44/what_are_the_best_climate_change_documentaries/,,61,41,1627067510.0
w15g48,climate_science,Researchers at MIT are advancing a concept to slow or potentially reverse climate change. It involves placing massive silicon bubbles at the direct point between the sun and our planet.,thecarmenator,https://www.reddit.com/r/climate_science/comments/w15g48/researchers_at_mit_are_advancing_a_concept_to/,[https://thred.com/tech/scientists-believe-space-bubbles-could-help-ease-climate-change/](https://thred.com/tech/scientists-believe-space-bubbles-could-help-ease-climate-change/),0,0,1658057683.0
u3ilzp,climate_science,Red Tides and Climate Change,bug_man47,https://www.reddit.com/r/climate_science/comments/u3ilzp/red_tides_and_climate_change/,"I hear a lot about the negative effects of red tides in classes and in news articles. I am curious about the benefits of these phenomena. 

Runoff from fertilizers and and generally an overabundance of nutrients added to waters causes algae to go into steroid mode. Since algae are responsible for at least much of our CO2 to O2 gas exchange, is red tide the environment's response to greater CO2 levels? Red tides are often depicted as a bad thing, but could it actually be beneficial?

Am I thinking about this accurately or am I missing something important?",11,2,1649945970.0
oykrpu,climate_science,"A critical ocean system may be heading for collapse due to climate change, study finds",Fungus_Schmungus,https://www.washingtonpost.com/climate-environment/2021/08/05/change-ocean-collapse-atlantic-meridional/,,131,16,1628177341.0
mlm61j,climate_science,Anthropogenic climate change is worsening North American pollen seasons,burtzev,https://www.pnas.org/content/118/7/e2013284118?,,101,44,1617744390.0
tfyp4o,climate_science,Spending deal strips funds for US/UN climate pledge to help low-income nations to mitigate and adapt to the impacts of climate change.,BasementBlock,https://www.rollcall.com/2022/03/16/spending-deal-undercuts-bidens-un-climate-pledge/,,31,0,1647480795.0
lkbyxw,climate_science,I am processing grief about climate change and at times I wonder if it is rational,Pasilanmies,https://www.reddit.com/r/climate_science/comments/lkbyxw/i_am_processing_grief_about_climate_change_and_at/,"Not sure if this is the right subreddit, but I’ll go ahead.

To me, it seems that the wider public can almost be split into three camps at this point:

There are the denials, who seem to be able to ignore reality.

Then there are the people who kind of realize that climate change is a major threat that needs to be dealt with. But as long as people fly a bit less and gradually switch to electric cars and do some fine tuning, everything will be fine. 

Then there are people who see it as an existential threat in the very near future.

I just feel that what would be needed to save humanity, would be a 180 degree turn. That there is no time to wait until 2050 or so to become carbon neutral.

Arctic ice is declining year by year. Mass extinctions are well underway. Permafrost is melting. Seasons have become less reliable. I live in Finland, and last year it is fair to say that we did not have a real winter. 

I am only 26, and yet I have seen a marked change even during my lifetime. Example: as a child and teenager, I used to play a lot of ice-hockey outside during the winters. Last several years the temperature has not been reliably below freezing for extended periods, so ice-hockey season has become weeks instead of moths. Instead of reliable less than -5, we often get spikes above 0, which ruins the ice. 

Silly example maybe, but that is an example of how I don’t understand how people don’t see what is happening right in front of our eyes.

I have read a fair bit of Guy McPherson, Paul Beckwith and others. I’ve also read that they are too alarmist, but I have not read any proper debunking of their positions. Especially global dimming seems to turn our situation to a catch-22, but that is almost never discussed in the mainstream.

Fundamentally, I am a person who wants to have a family at some point. But I have given up hope on that. I have also given up hope on reaching 40 years of age myself. For the last year and a half, I have become cynical and lived as if in hospice.

I am not new to climate issues. I remember first being disillusioned in 2009 when the Copenhagen summit was hyped up and then led to no action. 

I have tried to find optimism, but I have failed. I see Paris climate accord as a delusional hope, and yet almost all countries are even failing to keep on track with those demands.

I guess what I look for, is people who are informed, but not pessimistic. 

Is there any source for this?",85,52,1613388981.0
m4jvl5,climate_science,Forests could become sources of CO2 emissions due to climate change,berlioz1982,https://www.needforscience.com/ecology/forests-could-become-sources-of-co2-emissions-due-to-climate-change/,,63,31,1615682841.0
tj0egb,climate_science,"Potholer54 has a new video responding to the climate denial of Roy Spencer, one of that fringe minority of qualified scientists that dispute the consensus on climate change (which has made him a darling of Fox News etc.)",Lighting,https://www.youtube.com/watch?v=29QDGEJC1fg,,5,0,1647826721.0
tvm1fu,climate_science,GCM or Example Results for Simulating Hurricane Seasons Without Climate Change?,ThePhotogenicPotato,https://www.reddit.com/r/climate_science/comments/tvm1fu/gcm_or_example_results_for_simulating_hurricane/,"I am looking for either a GCM, that I, an individual could reasonably run to simulate several hurricane seasons, say without and with the impact of anthropogenic climate change. However, I am most interested in simple details like seasonal ACE, number of storms, etc as opposed to requiring information from the minutia of a highly-resolved simulation.

OR

literature detailing the results of an attempt to do this with statistical results I can utilize.",3,0,1649025301.0
oi1ig0,climate_science,Have there been any long term and indepth studies of the impacts of climate change on the economy?,Arowx,https://www.reddit.com/r/climate_science/comments/oi1ig0/have_there_been_any_long_term_and_indepth_studies/,"Surley there are some in depth economic projections/models for climate change scenarios, not just the temperature change graphs?

I know there have been some military scenarios projected and planned for e.g. Gwynne Dyer - Climate Wars.

With all the computing power of Wall St and the Financial industries surley they have run some climate/economic models/simulations of the potential futures beyond the next couple of years?",56,8,1625996306.0
m6p8zr,climate_science,Which regions will reforestation be the most effective in fighting climate change?,felixdixon,/r/environment/comments/m6p8pq/which_regions_will_reforestation_be_the_most/,,34,30,1615945946.0
onpquu,climate_science,Amazonia as a carbon source linked to deforestation and climate change,burtzev,https://www.nature.com/articles/s41586-021-03629-6.epdf?,,85,6,1626736568.0
ncwzh8,climate_science,What would be the consequence of climate change on world agriculture yields and food security? (I found a 450 pages IPCC report) [X POST],all_is_love6667,https://www.reddit.com/r/askscience/comments/ncwyqj/what_would_be_the_consequence_of_climate_change/,,71,10,1621078950.0
phuqse,climate_science,Global climate change impacts map: where can I find one?,_spectron_,https://www.reddit.com/r/climate_science/comments/phuqse/global_climate_change_impacts_map_where_can_i/,"Hello everyone.

I'm currently writting my MSc thesis on the effects of climate change in a group of primates, and I needed to find a nice world map of predicted climate change impacts for my introduction. Something that could inform the reader about where it is predicted that climate change will have more impacts.

Does anyone know a good reference?",34,5,1630773040.0
qcjiky,climate_science,Exposed - Leaked Report BBC Climate Change -Countries Self Interest Laid Bare - Nigel Green CEO,cryptoplatforms,https://www.reddit.com/r/climate_science/comments/qcjiky/exposed_leaked_report_bbc_climate_change/,"Exposed - Leaked Report BBC Climate Change -Countries Self Interest Laid Bare - Nigel Green CEO
https://youtube.com/watch?v=FxW9YrqeZvk",56,2,1634790509.0
o51z8c,climate_science,"Climate change is driving plant die-offs in Southern California, UCI study finds – Loss of vegetation cover is most stark in desert ecosystems already on edge of habitability",Exastiken,https://news.uci.edu/2021/06/21/climate-change-is-driving-plant-die-offs-in-southern-california-uci-study-finds/,,128,5,1624300308.0
ovc0na,climate_science,"Assuming just moderate climate change models, study predicts no where in the Bay Area (or to the south) will be suitable habitat for redwoods by the year 2030",caltrain208,https://www.researchgate.net/publication/279862769_Back_to_the_future_Using_historical_climate_variation_to_project_near-term_shifts_in_habitat_suitable_for_coast_redwood,,74,4,1627755101.0
om5d24,climate_science,"Arctic island suspends oil search - Greenland halts potentially lucrative coastal exploration, citing climate change",darkpyschicforce,https://enewspaper.latimes.com/infinity/article_share.aspx?guid=78d0c804-e38f-4dd0-9c41-97fdd449e5d3,,161,3,1626532352.0
p0ze17,climate_science,"Climate change widespread, rapid, and intensifying – IPCC",sirmclouis,https://www.ipcc.ch/site/assets/uploads/2021/08/IPCC_WGI-AR6-Press-Release_en.pdf?__cf_chl_jschl_tk__=pmd_56c6dd9286f99462c3d70fa379f1868cbeab32af-1628506802-0-gqNtZGzNAiKjcnBszQd6,,83,3,1628507628.0
mj9s7z,climate_science,Climate Change - Questions,TORM3NTO,https://www.reddit.com/r/climate_science/comments/mj9s7z/climate_change_questions/,"Hi everyone,

I have a few question about climate change for a project I'm working on. I know they might be very broad arguments and that there is no straight answer but I would appreciate having a discussing on this matter.

How would biomes in different climates change? For example: Would a temperate climate, such as Britain's, become more arid? How does research suggest it would change the landscape? Would vegetation die and leave dry lands or would it be substituted by vegetation that can better cope with the new climate?

Would you still be able to see the sun or would the sky be filled with a thick layer of clouds?

How would oxygen levels change? How could humans and animals adapt to those changes?

How high would radiation level rise? Would this make it impossible for humans to walk outside without protection?

I might have other questions later.

&#x200B;

Many thanks!",24,15,1617460827.0
n4nwvm,climate_science,Climate Change Dataset Demand Assessment [Survey],Elio_2,https://www.reddit.com/r/climate_science/comments/n4nwvm/climate_change_dataset_demand_assessment_survey/,"Hi everyone, My team and I at Elio are trying to identify critical gaps in climate research and create a centralized climate data platform. To accomplish this, we would like to learn about your experiences working with and finding climate change related data in your field of study or work. If you could complete this short survey and help us circulate it within your network, that would help us tremendously.

As a token of our appreciation, you will have a chance to enter a sweepstake to win one of four $25 gift cards from an (online) store of your choice!

Survey: https://forms.gle/dveBkHLVUmSw4uno9

Thank you very much!",45,5,1620133663.0
121ifo5,climate_science,"Is Mark Lynas' book ""Six Degrees: Our Future on a Hotter Planet"" still valid after 15 years?",00prometheus,https://www.reddit.com/r/climate_science/comments/121ifo5/is_mark_lynas_book_six_degrees_our_future_on_a/,"I am wondering how well I can use Mark Lynas' book, ""Six Degrees: Our  Future on a Hotter Planet"", as a reference? Have any major mistakes been  found since it's publication; is the book still valid? Is there a  better source regarding the long-term effects of climate change? Maybe  one that includes more up-to-date research?",24,23,1679742159.0
11qlesq,climate_science,Does anyone have some good “starter” resources for climate science for someone who’s been skeptical previously?,Archangel289,https://www.reddit.com/r/climate_science/comments/11qlesq/does_anyone_have_some_good_starter_resources_for/,"So first of all, hello everyone. Small introduction, I was raised in a conservative family and among the many tenants I was brought up under, “global warming isn’t real” was one of them. Now, I’m not disparaging my family, and I’m quite proud of how they did their best to raise me, and I still am comfortable and confident in many of my beliefs that I’ve established for myself in adulthood (I say this not to start any political debates, but to try to head off any “glad you escaped, they’re so backward” comments. Not why I’m here, please keep those kinds of politics to a minimum out of respect for others and the sub’s rules.) 

So all of that said, I’m really trying to be more open minded and aware of things, and I would like to read up more on the current science, the evidence we have for the current science, and general projections of what it looks like regarding climate change. What are we doing that’s causing damage, what can we do to fix the damage, what does the damage even look like, that sort of thing. 

My only request is that the resources be as unbiased as possible. Again, I’m not trying to be political, and that’s not what I mean by this. I just mean that a resource from someone’s “climate blog” or some such—even if they’re easy to understand and correct—will be very offputting to me if they’re also really preachy about it. I’d like to start with facts before getting too deep into someone’s opinions on those facts. 

I promise this is coming from a place of genuine interest and open-mindedness, I just know myself and will probably be *more* put off by a climate doomsday preacher (no matter their accuracy) than I would by scientific publications or less biased science communicators. 

So any help y’all can provide would be welcome! Journals, unbiased blogs, articles, YouTube videos, Netflix documentaries, hit me with your best stuff. Please!",43,31,1678740847.0
prxy2p,climate_science,"Uncertainties, Limits, and Benefits of Climate Change Mitigation for Soil Moisture Drought in Southwestern North America",burtzev,https://agupubs.onlinelibrary.wiley.com/doi/10.1029/2021EF002014?,,19,0,1632154113.0
izyn46,climate_science,Climate change/green energy careers to look into?,lymeguy,https://www.reddit.com/r/climate_science/comments/izyn46/climate_changegreen_energy_careers_to_look_into/,"With the assumption that green energy is likely to be the way of the future as thing move forward, I'm wondering are there some careers out there worth looking into that you also don't have to be something like a PHD to excel in?

Asking as someone in my 30's considering some kind of career to look into...  

and as someone that thinks green energy is the way of the future, it would be interesting if there was something feasible to get into that also doesn't require me to be a science or math genius at the same time either.

Thanks!",20,8,1601092002.0
eesu0r,climate_science,What is the best way to get a broad understanding of the science behind Climate Change,sipiwi94,https://www.reddit.com/r/climate_science/comments/eesu0r/what_is_the_best_way_to_get_a_broad_understanding/,"Hey guys.

I am creating an organization that focuses on Climate Change. It is really important that we have a deep understanding of Climate Change and that our knowledge (at least the most important) is based on the journals and articles that they were published in. 

I finished psychology at a university so I understand most academic literature, but my understanding of physics/chemistry etc. isn't at a university level.  


Does anybody know the easiest way to acquire the knowledge I need? Some people said IPCC reports are the place to go.",33,23,1577145276.0
p1racx,climate_science,"Are there any collections available of attempted falsifications/refutations of standing theories in climate science? It would be educational to read, but might also be useful in discussions with climate change deniers.",KettleFromNorway,https://www.reddit.com/r/climate_science/comments/p1racx/are_there_any_collections_available_of_attempted/,,6,1,1628608718.0
ime7a9,climate_science,Aviation contributes 3.5% to the drivers of climate change that stem from humans,nnomadic,https://phys.org/news/2020-09-aviation-contributes-drivers-climate-stem.html,,37,5,1599218787.0
au5m8m,climate_science,"Can someone please give me a detailed breakdown as to why there is such vehement climate change denial? I do not want any kind of political opinion in relation to this. Rather, I'm hoping to get an objective analysis. More details in the post.",41treys,https://www.reddit.com/r/climate_science/comments/au5m8m/can_someone_please_give_me_a_detailed_breakdown/,"I came here hoping to hear a relatively neutral explanation from someone familiar with/currently in the field and seeing if they could break down the points, rationale, and chronology behind it as well. While I know little to nothing about climate science, I know scientists (having been a researcher in Cancer Biology previously before leaving the field) typically have the utmost respect for data, analytics, and the word of experts in fields not their own. For me it's very dumbfounding to see how people contest qualified, entrenched professionals, and I was hoping to hear first hand how the situation has gotten to where it is today. I hope this adheres properly to Rule 3 on the sidebar. Again, I want no part of a political argument here, just an objective as possible analysis to my question.",24,61,1550992666.0
a5wotc,climate_science,"For those of you who are optimistic/hopeful about climate change, can you explain why?",Spacehillbilly,https://www.reddit.com/r/climate_science/comments/a5wotc/for_those_of_you_who_are_optimistichopeful_about/,,28,68,1544729052.0
cgv5pv,climate_science,I'm an activist with Extinction Rebellion and would like to ask for help with communicating the science of climate change.,naufrag,https://www.reddit.com/r/climate_science/comments/cgv5pv/im_an_activist_with_extinction_rebellion_and/,"I believe that our planet is facing a climate and ecological emergency that demands an appropriately strong response, and have chosen to work with my local Extinction Rebellion (XR) group to present a version of XR's talk, ""[Heading for Extinction and What To Do About It](https://www.youtube.com/watch?v=QaFBnUyDXpk&t=1s)."" Despite the title, the conclusion of this presentation is -not- that we are doomed to certain extinction. As Dr. Kate Marvel has said, ""[HUMANS PROBABLY WON'T GO EXTINCT BECAUSE OF CLIMATE CHANGE BUT WE SHOULD SHOOT FOR SOMETHING BETTER THAN ""NOT EXTINCT"" COME ON PEOPLE RAISE YOUR STANDARDS!](https://twitter.com/DrKateMarvel/status/1135637164467863553)""

 I'm aware that there has been some miscommunication of climate science by individuals within XR. The first of XR's demands is to tell the truth about the climate emergency- and that includes accurately conveying the scientific understanding of climate change to a public audience. 

I'm not a climate scientist nor do I have any formal education in climate science. I would like to put out a call for help from individuals who do have such training or are active in climate science who are willing to assist in clarifying questions around climate change from within XR. I would also like to invite and welcome criticism of the scientific basis of XR's communication, as well as my own communication. I think that greater engagement from the scientific community with public communication and social movements acting on climate change has the potential to amplify our effectiveness.

Thank you!",53,25,1563900768.0
ga08ha,climate_science,Meteorologists against climate change?,theredcameron,https://www.reddit.com/r/climate_science/comments/ga08ha/meteorologists_against_climate_change/,I've seen a number of meteorologists who are against climate change and use their expertise to show that they know climate science. How much about climate science do meteorologists really know? Why do many of them feel they know more than climatologists?,16,14,1588123900.0
gotsnt,climate_science,Accelerated weathering of olivine in tropical shelf seas proposed to kill climate change,strength_of_savy,https://projectvesta.org/science/,,24,9,1590188300.0
