id,subreddit,title,author,url,selftext,score,num_comments,created_utc
6qnd7y,climate_science,Abrupt Climate Change (and my ultimate weltschmertz),MaximinusDrax,https://www.reddit.com/r/climate_science/comments/6qnd7y/abrupt_climate_change_and_my_ultimate_weltschmertz/,"Hello Everyone.

My growing interest in studying climate science has led me across thoroughly bleak analyses and predictions towards our mutual future (e.g Guy Mcpherson's work). He's been described (in an article critical of his work) as a photo-negative of the climate-denier sphere, citing numerous feedback loops that may lead us away from linear energy budget growth models and towards exponential ones.

One example of such a feedback loop - As temperatures rise in the boreal forest, reduced permafrost coverage also reduces the refractive index of the ground, leading to higher heat absorption, which feeds back into reduced coverage.

Another topic I was made aware of is that of global dimming, which implies that reducing the amount of pollutants in our atmosphere would (at this point) lead to an increase in the total irradiance, tilting the energy budget further.

Setting those examples (of which there are many more) aside, I am as alarmed by these issues as I am appalled by the conclusions they draw - that modern human society can (and, according to Mcpherson, already has) lead to abrupt and irreversible changes in our climate patterns that would leave this planet uninhabitable (at the very least, for us). Up until that point, I was mostly aware of the linear, reversible trends our actions induce.

So, after all this morose rambling, I wanted to ask you fellow scientists:

* Can you point me to studies and projective models that take feedback mechanisms into account, set a lower/upper limit on their impact, and modify the trends accordingly? I was unable to do so myself.

* (optional) Provide any counterpoints which would offset the overwhelming pessimism I'm currently experiencing? Personally, I'm trying my best to adjust my lifestyle (stopped eating meat, driving, flying when possible) and affect other people's opinions (to extremely limited success) but at this point in my life (having just turned 30) I'm not even sure what future I should plan for (e.g should I be having kids?? I'm not really expecting an answer on that...)",14,10,1501493953.0
6yllr8,climate_science,Synchronous volcanic eruptions and abrupt climate change ∼17.7 ka plausibly linked by stratospheric ozone depletion,burtzev,http://www.pnas.org/content/early/2017/08/29/1705595114.full,,5,0,1504767339.0
87795u,climate_science,Abrupt Climate Change in an Oscillating World,SvanteArrheniusAMA,https://www.nature.com/articles/s41598-018-23377-4,,11,0,1522048702.0
rw3n4b,climate_science,The projected timing of abrupt ecological disruption from climate change,Levyyz,https://www.nature.com/articles/s41586-020-2189-9,,68,6,1641327489.0
fyl3yr,climate_science,The projected timing of abrupt ecological disruption from climate change,KeybladeAxel19,https://www.nature.com/articles/s41586-020-2189-9,,29,2,1586542100.0
e2vqmz,climate_science,Climate tipping points — too risky to bet against. The growing threat of abrupt and irreversible climate changes must compel political and economic action on emissions,In_der_Tat,https://www.nature.com/articles/d41586-019-03595-0#ref-CR11,,50,17,1574933180.0
12ro3m4,climate_science,Climate change: multi-country media analysis shows scepticism of the basic science is dying out,Zomaarwat,https://theconversation.com/climate-change-multi-country-media-analysis-shows-scepticism-of-the-basic-science-is-dying-out-198303,,64,0,1681898824.0
6im562,climate_science,Abrupt North Atlantic circulation changes in response to gradual CO2 forcing in a glacial climate state,SvanteArrheniusAMA,https://www.nature.com/ngeo/journal/vaop/ncurrent/full/ngeo2974.html,,15,6,1498055230.0
12momlt,climate_science,Paper on how climate change affects people differently.,Wtfzalie,https://www.reddit.com/r/climate_science/comments/12momlt/paper_on_how_climate_change_affects_people/,"Hey everyone, like title says, I’m writing a paper on how climate change affects people differently, or how some people/communities suffer more than others. 
My ideas include: 
Farmers- specifically those in drought prone areas
Indigenous people 
Elderly

I’m just wondering if anyone has any points that could help me out? 
Or if anyone has any other groups of people that’ll suffer more, let me know!",1,1,1681529894.0
11h2td7,climate_science,Mediterranean region / Spain & climate change - detailed projections on habitable areas?,sunrisedown,https://www.reddit.com/r/climate_science/comments/11h2td7/mediterranean_region_spain_climate_change/,"I'm reading and hearing a lot on how sea level rise, draught and heart are probably large parts of the Mediterranean uninhabitable.
Id like to understand in more detail which areas and timeframes we're talking about.

Any hints on where to look at/turn to?

Is there for example a more in depth analysis for Spain?

Thanks a lot!",16,4,1677855522.0
119vm5p,climate_science,Is where we choose to live the most impactful action to protect us from climate change?,JVillella,/r/Futurology/comments/119vkx1/is_where_we_choose_to_live_the_most_impactful/,,20,1,1677152280.0
11q9zf7,climate_science,Perspectives on Climate Change (Resources),Arlathen,https://www.reddit.com/r/climate_science/comments/11q9zf7/perspectives_on_climate_change_resources/,"Does anyone have any tips, tricks, resources, insights into how to efficiently change perspectives on Climate Change (CC) issues? I mean on a social basis, and (not to be harsh but) I mostly mean with older crowds of people in communities and businesses alike. Spitting facts at someone is almost always not the socially aware solution. 

Comments like ""but don't they just want us to go back to the stone age and not use electricity"" or ""we should just go back to coal power, there's still plenty of coal in the ground to use"" are some thing I hear whenever CC is brought up amongst older collages, and despite how utterly stupid and wrong (no offense) those comments are. Saying that in a discussion obviously won't change their minds.

But what is? Those people often full heartedly believe what they're saying either because they don't know better or because you're basically arguing against what they've always known (I suppose in a similar way to arguing against ones religious beliefs).",2,1,1678714719.0
z6wai1,climate_science,Do people have the information they need to determine their greenhouse gas footprint? How do I even know that my lifestyle is minimizing not maximizing climate change?,mini_van_hipster,https://www.reddit.com/r/climate_science/comments/z6wai1/do_people_have_the_information_they_need_to/,,17,19,1669641299.0
xtyutw,climate_science,"Scientists say the ozone may be fully healed within 50 years- Before climate change dominated headlines globally, our deteriorating ozone was the prime ecological concern. Decades later, scientists now claim a full recovery could be on the cards before the century’s end.",thecarmenator,https://www.reddit.com/r/climate_science/comments/xtyutw/scientists_say_the_ozone_may_be_fully_healed/,[https://thred.com/tech/scientists-say-the-ozone-may-be-fully-healed-within-50-years/](https://thred.com/tech/scientists-say-the-ozone-may-be-fully-healed-within-50-years/),176,29,1664742306.0
x63s8f,climate_science,"""Climate Change is Junk Science"" - Senator Gerard Rennick",chedzz,https://www.reddit.com/r/climate_science/comments/x63s8f/climate_change_is_junk_science_senator_gerard/,"According to a Facebook post published by Senator Gerard Rennick 4 Sept -   


Climate change is junk science. 

The science of heat is governed by the laws of Thermodynamics. 

Heat is kinetic energy, the energy of motion - it does not get trapped by CO2 because it’s a gas. 

Yet this is the theory pushed by the climate change alarmists. 

To describe the impact of CO2 as being like a greenhouse is farcical. A greenhouse works by using a solid object to trap convection before the air cools and condenses. CO2 is not a solid object. 

CO2 absorbs and emits radiation. It does not trap convection. Furthermore it absorbs and emits incoming radiation at 2.8 microns while only absorbing outgoing radiation at 14.8 microns. 

Applying planks rule e = hv, the incoming radiation absorbed by CO2 is 5 times more powerful than the outgoing radiation absorbed. 

Regardless, as Einstein said in 1917, the amount of energy transferred by radiation is so small it always drops out. 

The most powerful form of heat transfer in the atmosphere is convection which is governed by the second law of thermodynamics. The entropy of a system must always increase. 

As such hot air will rise not fall. Outer space is negative 270 degrees Celsius. Our atmosphere is always losing heat because of this differential.  
\_\_\_\_\_\_\_\_\_\_\_\_\_\_\_\_\_\_  


Any climate scientists here whom may fact check this?",83,94,1662342502.0
zoadpb,climate_science,"“There is a concern I have, after the study, that firearm-related violence will rise as climate change continues.” – Dr Vivian Lyons, University of Washington, Seattle #GlobalCarbonFeeAndDividendPetition",Keith_McNeill65,https://www.theguardian.com/world/2022/dec/16/almost-8000-us-shootings-attributed-to-unseasonable-heat-study,,36,2,1671295615.0
zshizg,climate_science,"College Biology Textbooks Make Little Mention of Climate Change, Study Shows",YaleE360,https://e360.yale.edu/digest/climate-change-college-textbooks,,37,1,1671700053.0
xyu1ok,climate_science,Climate change and the threat to civilization,In_der_Tat,https://www.pnas.org/doi/full/10.1073/pnas.2210525119,,29,11,1665238991.0
z6iegv,climate_science,Scientists' warning on climate change and insects,burtzev,https://esajournals.onlinelibrary.wiley.com/doi/full/10.1002/ecm.1553?campaign=wolearlyview,,54,1,1669597359.0
y17e6d,climate_science,One of the world's leading research centers is trying to educate STEM professionals about the existence of its climate change resources. Please take this 5-minute survey about using scientific and climate change resources to help it find better ways to share its data-driven resources with STEM pros.,CommsGradStudent,https://www.reddit.com/r/climate_science/comments/y17e6d/one_of_the_worlds_leading_research_centers_is/,"Hello STEM professionals,

I am completing my final communications project at Georgetown University for my master’s degree in Public Relations and Corporate Communications. For the last few months, I have been working with one of the world’s foremost research centers to develop a communications plan that will help us understand how STEM professionals learn about scientific resources or climate change resources produced by third-party sources that are available for their use. The results of this research will be used to find more effective ways for my client to tell STEM professionals about its science research centers’ climate change resources that are available for them to use. 

The survey is completely anonymous, should take approximately 5 minutes to complete, and is linked here: [https://georgetown.az1.qualtrics.com/jfe/form/SV\_5aQAqbMSbUJJBiu](https://georgetown.az1.qualtrics.com/jfe/form/SV_5aQAqbMSbUJJBiu). The survey will close on October 22, 2022, at 11:59 p.m. ET.

Thank you for your help! I appreciate your time and look forward to analyzing the results.",24,6,1665490074.0
xeu7p2,climate_science,Billionaire No More: Patagonia Founder Gives Away the Company | Ownership transferred to a trust to ensure the company’s independence and ensure that all of its profits — some $100 million a year — are used to combat climate change and protect undeveloped land around the globe.,Waste_Gain,https://www.nytimes.com/2022/09/14/climate/patagonia-climate-philanthropy-chouinard.html,,167,5,1663240815.0
z3jbhx,climate_science,Climate Change and Vectorborne Diseases,burtzev,https://www.nejm.org/doi/full/10.1056/NEJMra2200092?qu,,31,0,1669294749.0
z1ccp3,climate_science,Climate Change - Global Emissions Data by Country and Sector (via Climate TRACE),n1nja5h03s,/r/datasets/comments/z1ai7x/climate_change_global_emissions_data_by_country/,,24,0,1669069580.0
xiyfa0,climate_science,"Climate change likely increased extreme monsoon rainfall, flooding highly vulnerable communities in Pakistan",burtzev,https://www.worldweatherattribution.org/climate-change-likely-increased-extreme-monsoon-rainfall-flooding-highly-vulnerable-communities-in-pakistan/,,41,4,1663646414.0
s3eam2,climate_science,"Past abrupt changes, tipping points and cascading impacts in the Earth system",Levyyz,https://www.nature.com/articles/s41561-021-00790-5,,27,2,1642120310.0
yg1cxa,climate_science,The New World: Envisioning Life After Climate Change (unlocked NYT article),unknown_travels,https://www.nytimes.com/interactive/2022/10/26/magazine/visualization-climate-change-future.html?unlocked_article_code=AAAAAAAAAAAAAAAACEIPuonUyYiZ_tU1Gw5CRWySB4B99Frf3b-Vnvs5j3D3PimTRHFczv8ICoyB6U7RZK1lItA33jGSWNIEO78mQvN_i-FCI1F3Rk-ovp6A0twjEhkClLiSDCkwzo6fGvc59yPndGCyNOZhyfqxtU3Zbma9XLjchidwOAo2qZV6fVuh22gKk_zCRbYk2tcv3fwxF9stE2d7ESqJvPbsDBh1O92UPFqLukRtBbYvCXyElsWc6rkAbA1QFVnMKXh86mw449hdU8gFaOe9d1VzPZqj3shCTzBgP4yrBJYuR4DLl70MsrbFqxOEy8De1OxNxjjEFwf1RQ3M3Q6AqzTa&smid=nytcore-ios-share&referringSource=articleShare,,18,1,1666993199.0
w77u0t,climate_science,"An interactive global map shows the damage of climate change in real time- Prior to 2022, attaining digital renderings of our planet’s geology has been a lengthy and arduous task- now there is an interactive timespan of the globe between 2017 to 2021.",thecarmenator,https://thred.com/tech/interactive-global-map-shows-the-damage-of-climate-change-in-real-time/,,31,7,1658701710.0
xl3esz,climate_science,"For a Climate Scientist and Mother, Climate Change Is Generational ‘Robbery’",YaleE360,https://e360.yale.edu/features/diana-urge-vorsatz-climate-change,,55,0,1663858022.0
w97hiu,climate_science,The audacious PR plot that seeded doubt about climate change,Fando1234,https://www.bbc.co.uk/news/science-environment-62225696,,60,3,1658904254.0
uyx80c,climate_science,"Climate change facts, solutions, and additional resources.",iboughtarock,https://www.reddit.com/r/climate_science/comments/uyx80c/climate_change_facts_solutions_and_additional/,"# Facts:

* Daily we emit 117 million tons of CO2. Global CO2 emissions are 43 billion tons each year. [\[S\]](https://www.epa.gov/climate-indicators/climate-change-indicators-global-greenhouse-gas-emissions)
* As CO2 concentrations build in the atmosphere, infrared light radiated from earth's surface is absorbed by the CO2. Thus trapping heat in earth's atmosphere. This is known as the greenhouse effect. [\[S\]](https://en.wikipedia.org/wiki/Greenhouse_effect)
* 38% of global CO2 emissions have dissolved in the oceans. When CO2 dissolves in water it forms carbonic acid. This is known as ocean acidification. [\[S\]](https://www.sciencedirect.com/science/article/pii/B9781856176361000122?via%3Dihub) [\[S\]](https://en.wikipedia.org/wiki/Ocean_storage_of_carbon_dioxide) [\[S\]](https://www.pmel.noaa.gov/pubs/outstand/feel2633/feel2633.shtml)
* The ocean has 50 times more CO2 than the atmosphere. The ocean has 39,000 billion tons of CO2. The atmosphere has 750 billion tons of CO2. [\[S\]](https://www.sciencedirect.com/science/article/pii/B9781856176361000122?via%3Dihub)
* As the ocean becomes more acidic, less CO2 is able to be stored in the water. This leads to CO2 being released from the ocean and sent to the atmosphere. The same goes for ocean temperature. As water temperature rises, less CO2 is able to stay dissolved (e.g. leave a carbonated drink out on a warm day). [\[S\]](https://agupubs.onlinelibrary.wiley.com/doi/full/10.1002/2016RG000533)
* As temperatures rise, soil begins to increase the release of carbon in a process known as soil respiration. Researchers estimate soil carbon loss over the 21st century will be equivalent to two decades of carbon emissions from burning fossil fuels. [\[S\]](https://www.science.org/doi/10.1126/science.aan2874)

# Solutions:

* **Ocean alkalinity enhancement (OAE):** Use mafic and ultramafic rocks (olivine, peridotite, etc.) to bind to CO2 and form carbonates. Thus converting CO2 into an alkaline carbonate mineral. These carbonates could then be placed in the ocean to raise the pH and bring it back to normal levels, and increase CO2 storage capacity in the ocean. [\[S\]](https://pubs.acs.org/doi/full/10.1021/acssuschemeng.0c08561) [\[S\]](https://www.frontiersin.org/articles/10.3389/fclim.2019.00007/full)
* **Direct air capture (DAC):** Use large fans to concentrate CO2 into a chamber and then absorb the CO2 by various means. The CO2 can be converted into a long term storage medium such as a carbonate or left as vapor CO2. In the case of vapor CO2 there is some commercial value or it can be pumped into geological wells for storage. [\[S\]](https://en.wikipedia.org/wiki/Direct_air_capture)
* **Renewable energy:** Wind, solar, geothermal, wave/tidal/marine power, etc. [\[S\]](https://en.wikipedia.org/wiki/Renewable_energy)
* **Cultured meats:** Growing meat from cell cultures instead of factory farming. This would free up billions of acres globally, democratize access to protein sources, and eliminate CO2 and CH4 emissions associated with factory farming. In the United States 41% of land use goes towards grazing and animal feed crops. These areas of land are usually high in sunlight and could be used for solar, wind, afforestation, or DAC. [\[S\]](https://www.ers.usda.gov/topics/farm-economy/land-use-land-value-tenure/major-land-uses/) [\[S\]](https://cellbasedtech.com/lab-grown-meat-companies) [\[S\]](https://en.wikipedia.org/wiki/Cellular_agriculture)
* **Reducing fossil fuel emissions:** This can be done by scrubbing some of the CO2 from the source before emitting it to the atmosphere. [\[S\]](https://en.wikipedia.org/wiki/Carbon_dioxide_scrubber)
* **Afforestation:** Afforestation is the establishment of a forest in an area where there was no previous tree cover. Tree-planting campaigns are sometimes criticized for targeting areas where forests would not naturally occur, such as grassland and savanna biomes. Afforestation can negatively affect ecosystems through increasing fragmentation, edge effects, and making the surface albedo darker (especially in northern regions). [\[S\]](https://en.wikipedia.org/wiki/Afforestation)
* **Other:** nuclear [fission](https://en.wikipedia.org/wiki/Generation_III_reactor)/[fusion](https://en.wikipedia.org/wiki/ITER), [enhanced crop weathering](https://www.nature.com/articles/s41586-020-2448-9), [solar shield at L1](https://en.wikipedia.org/wiki/Space_sunshade), [ocean afforestation](https://www.marinebiomass.com/), [cloud seeding](https://en.wikipedia.org/wiki/Cloud_seeding), [ocean fertilization](https://en.wikipedia.org/wiki/Ocean_fertilization), large scale albedo alterations, painting arctic rocks white, dispersing low density CO2 absorbents.

# Carbon Capture/Sequestration Companies:

* [**SeaChange**](https://www.seachangeinc.co/)**:** Absorb CO2 from the ocean utilizing the abundance of magnesium and calcium dissolved in seawater. Sodium hydroxide (NaOH) is additionally needed to make the water more alkaline. [\[Paper Outlining Operation\]](https://pubs.acs.org/doi/full/10.1021/acssuschemeng.0c08561) [\[YouTube Presentation\]](https://www.youtube.com/watch?v=9XJ4A9yjeS8)
* [**Carbon Iceland**](https://carboniceland.is/about/)**:** Direct air capture (DAC) in Iceland. Plan to capture 1-2 million tons of CO2 each year.
* [**Carbon Engineering**](https://carbonengineering.com/our-technology/)**:** DAC with ability to capture 1 million tons/year. Uses potassium hydroxide and ends up with vapor CO2.
* [**Project Vesta**](https://www.vesta.earth/)**:** Use ground olivine to convert CO2 from the ocean and atmosphere into carbonates.
* [**Planetary Tech**](https://www.planetarytech.com/technology/)**:** Refine mine tailings to produce alkaline hydroxides. Hydroxides are then transferred to ocean outfall sites where the hydroxides are combined with sea water and bind to CO2.
* [**Climeworks**](https://climeworks.com/co2-removal)**:** Develops, builds and operates direct air capture machines.
* [**Aker Carbon Capture:**](https://akercarboncapture.com/about-us/key-projects/) Capture carbon directly at sources.
* [**Norsk e-Fuel**](https://www.norsk-e-fuel.com/)**:** Transform CO2, water and electricity into renewable fuels. First plant will start production in 2024 and will be gradually scaled to produce 25 million liters within 2026.
* [**4 per 1000**](https://4p1000.org/discover/?lang=en)**:** Increase carbon sequestration in soils
* [**More Companies**](https://www.xprize.org/prizes/elonmusk)

# Other Companies:

* [**The Ocean Cleanup**](https://theoceancleanup.com/)**:** Autonomous garbage collection for pollution in oceans and rivers.
* [**Upside Foods**](https://upsidefoods.com/our-foods/)**:** Synthetic chicken produced via cell cultures and bioreactors. More information on [cellular agriculture](https://en.wikipedia.org/wiki/Cellular_agriculture). [\[30+ cultured meat companies\]](https://cellbasedtech.com/lab-grown-meat-companies) [\[More Companies\]](https://vegfaqs.com/lab-grown-meat-companies/)
* [**DroneSeed**](https://droneseed.com/)**:** Afforestation via drones strategically dropping seeds.

# Papers:

* [In situ carbonation of peridotite for CO2 storage](https://www.pnas.org/doi/10.1073/pnas.0805794105)
* [Pathway for gigatonne-scale CO2 management with water based CO2 mineralization](https://pubs.acs.org/doi/full/10.1021/acssuschemeng.0c08561)
* [Mapping mineral resource base for mineral CO2 capture in the United States](https://pubs.usgs.gov/ds/414/)
* [Mapping mineral resource base for mineral CO2 capture in the Europe](https://www.mdpi.com/2075-163X/9/8/485)
* [CO2 removal via enhanced rock weathering with croplands](https://www.nature.com/articles/s41586-020-2448-9)
* [Increasing temperature's effect on soil respiration](https://www.science.org/doi/10.1126/science.aan2874)

# Resources:

* [NASA Climate](https://climate.nasa.gov/): General information
* [National Academies Report](https://nap.nationalacademies.org/read/26278/chapter/1): 300 pages on ocean CO2 sequestration
* [CDR Community](https://community.oceanvisions.org/): View and explore active research and projects
* [IPCC Summary](https://www.ipcc.ch/srccl/chapter/summary-for-policymakers/)
* [Project Drawdown](https://www.youtube.com/playlist?list=PLwYnpej4pQF7sB5_ZmS2IjFae5M7MafiF): Climate solutions YouTube playlist
* [Book List](https://b-ok.cc/booklist/650697/108d48?new): textbooks and non-fiction
* [30+ Wikipedia Pages](https://www.reddit.com/user/iboughtarock/comments/uy7t2b/wikipedia_links_climate_change/)

Even after doing all this research there is still much I do not know. I am sharing these resources to help others if they choose to pursue this topic further. Here is a [google doc](https://docs.google.com/document/d/1F6fIiVhpQ0CrG4CEFWYrja_Tj9XzmMVKnB1l-TF9SBo/edit?usp=sharing) of various notes I took. And here are [many Wikipedia pages](https://www.reddit.com/user/iboughtarock/comments/uy7t2b/wikipedia_links_climate_change/) that contributed greatly to my research. I am now primarily focused on carbonate based oceanic CO2 sequestration. If anyone has further information on that please send it my way.",67,10,1653654737.0
x24qxr,climate_science,Probabilistic projections of increased heat stress driven by climate change,burtzev,https://www.nature.com/articles/s43247-022-00524-4,,43,1,1661921952.0
wxisi5,climate_science,Climate Change May Have Doubled the Number of Houston Homes Flooded by Hurricane Harvey,YaleE360,https://e360.yale.edu/digest/hurricane-harvey-climate-change-double-flooding-homes,,43,1,1661445150.0
xd67vb,climate_science,Global ‘Stilling’: Is Climate Change Slowing the World’s Wind?,YaleE360,https://e360.yale.edu/features/global-stilling-is-climate-change-slowing-the-worlds-wind,,13,0,1663072113.0
wk48c1,climate_science,Over half of known human pathogenic diseases can be aggravated by climate change,burtzev,https://www.nature.com/articles/s41558-022-01426-1.epdf?sh,,38,1,1660054030.0
wjw06r,climate_science,Climate Endgame: Exploring catastrophic climate change scenarios,In_der_Tat,https://www.pnas.org/doi/10.1073/pnas.2108146119,,32,0,1660026521.0
vo71ti,climate_science,Role of Blue Carbon in Mitigating Climate Change,powerlilies,https://decodingbiosphere.com/2022/06/29/role-of-blue-carbon-in-mitigating-climate-change/,,20,3,1656591637.0
w59ysk,climate_science,Relationship between extinction magnitude and climate change during major marine and terrestrial animal crises,burtzev,https://bg.copernicus.org/articles/19/3369/2022/,,51,0,1658494638.0
voz93l,climate_science,"The Arctic and the Third Pole - Himalaya regions are at the frontlines of climate change, warming at a rate 2-3 times faster than the global average",ShovelingSnow,https://fb.watch/d_DbST-HO3/,,41,0,1656677173.0
